Цитата №;Дата;Цитата;Рейтинг
Цитата #17274; 18 ноября 2010 ;ckkpss: особую пикантность ситуации придаёт то, что в Екатеринбурге на ночь отключают уличное освещение, поэтому многочисленные камеры слежения, расположенные в центре, которые могли бы помочь найти и задержать злоумышленников, оказались совершенно бесполезны.rockamark: в Екатеринбурге на ночь отключают уличное освещение... УРАЛ, Я ЛЮБЛЮ ТЕБЯ!ant0hio: т.е. в светлое время суток уличное освещение работает как надо?ckkpss: в светлое оно не работает, потому что и так светло.Protopop_Avvakum: Ни у кого не возникает закономерного вопроса - Нахуя вам фонари?;764
Цитата #17703; 9 декабря 2010 ;xxx: а какого числа ты осчастливил это мир?yyy: не знаю, я еще не умер;764
Цитата #18007; 22 декабря 2010 ;ххх: ТЫ ЛЕНТЯЙ!ууу: ага...ххх: Ты САМЫЙ ленивый человек на свете!ууу: ага...ххх: Человек ленивее тебя ЕЩЁ НЕ РОДИЛСЯ!!!ууу: Ему было лень...;764
Цитата #18210; 30 декабря 2010 ;xxxx: Ты чо, я с ней не сплю. И не спал никогда!xxxx: И не собираюсь!xxxx: И даже не представляю себе ситуацию, чтоб с ней это самое. Я столько не выпью, даже на сегодняшнем корпоративе!... два дня спустя ...xxxx: Ты не поверишь....;764
Цитата #33002; 30 августа 2012 ;/вторую неделю замужем/xxx:семейная жизнь блин!!!!!вчера ночью с мужем дошло до супружеского долга, он весь такой лапа-лапа, а я лежу, ваще ничего не хочу и думаю о том, какая я молодец и как классно плиту очистила!!;764
Цитата #12620; 14 апреля 2010 ;"@lex: купил новую микроволновку.@lex: Два часа отдирал наклейку с надписью ""Жизнь проще, чем кажется""";763
Цитата #15050; 12 августа 2010 ;ххх: сегодня утром будильник звонит в 8:15ххх: я его вырубаю, думаю, счас встануххх: уснул, просыпаюсьххх: смотрю на часы - 8:16ххх: минуту проспалххх: думаю, ладно, надо вставатьххх: открыл глаза, моргнулххх: смотрю на часы, а там 9:30ххх: не буду больше моргать;763
Цитата #16604; 18 октября 2010 ;первый: загадка. В 12-этажном доме есть лифт. На первом этаже живет всего 2 человека, от этажа к этажу количество жильцов увеличивается вдвое. Какая кнопка в лифте этого дома нажимается чаще других?второй: 1 этажа?третий: выход или вход?!четвёртый: меня больше беспокоит, что на последнем этаже живёт 4096 человек. Какая-то бригада гастарбайтеров...;763
Цитата #16724; 22 октября 2010 ;xxx: Москва по большей части состоит из приезжего быдла, с колхозов и регионов.xxx: Издревле вся местная интеллигенция была либо расстреляна, либо смоталась в дальние страны.yyy: Ну вы-то конечно не такой, вас наверняка расстреляли.;763
Цитата #17051; 8 ноября 2010 ;"ххх: это эпик. просто.ххх: сегодня девушка с огромными metroвскими пакетами зашла в автобус, кругом все места заняты, причём сидят одни мужики. уступить ей никто не собирался. оглянулась так и громко, с характерным тяжким вздохом, произнесла: ""я смотрю, у нас тут чисто женская компания собралась"".ххх: мест освободилось штук восемь";763
Цитата #10680; 27 декабря 2009 ;у нас сегодня только четверо вышли на работу)я, два программера и бухгалтервсе, естественно, страдают хуйнейкроме программистов и бухгалтера;762
Цитата #11693; 24 февраля 2010 ;В чате в 4 утра:Joker: давайте устроим виртуальную групповуху?Joker: начнем с того, кто во что одет? я вот в одних трусах лежу...Киса: я в маечке и шортиках!Барс: я в чем мать родила.Лисица: а я в красивом нижнем бельеШурик: а я в форме и бронежелете. я в милиции работаю, на сутках сейчас...;762
Цитата #14682; 26 июля 2010 ;xxx: слушай, я еще вчера хотела сказать: прости пожалуйста, что я тебя на день рождения не позвала. не хочу оправдываться, прости просто.yyy: у тебя день рождения был?;762
Цитата #17410; 25 ноября 2010 ;"ххх: я емyyy: ладно, покушай, потом поговоримxxx: lf vj;tv lfkmit ,jknfnmyyy: не говори с набитым ртом";762
Цитата #11566; 17 февраля 2010 ;"Блин, похоже я поправилась :(да ну брось! У тебя идеальные параметры! ;))честно? :)Да!90 120 176 - как у снеговика! :)ДА ПОШЁЛ ТЫ!";761
Цитата #11941; 10 марта 2010 ;xxx: некоторые номера надо сохранять в телефоне только для того, чтобы ни в коем случае не поднимать трубку;760
Цитата #16247; 6 октября 2010 ;яяя: 1,14 гига - много, долго качаться будет...ччч: Ну оставь на ночь включённым компяяя: Я так не могу. Ну мало что может случиться...ччч: угу, может. прорвёт сетевой кабель и интернетом затопит соседей.;760
Цитата #17110; 11 ноября 2010 ;Звонок из института. Беру трубку.- Алло, это из отдела трудоустройства. вы можете сейчас говорить?- Я в армии.- Ну давайте я вам через час перезвоню?И чо ты думаешь? ПЕРЕЗВОНИЛА!;760
Цитата #17392; 24 ноября 2010 ;"sdf: Сегодня у цирка видел припаркованную БМВ Х6 у которой под дворником была зажата рекламная листовка с надписью ""Надоело жить от зарплаты до зарплаты?""";760
Цитата #17702; 9 декабря 2010 ;"xxx: Захожу утром в больницу, там рамка металлоискателя, прохожу сквозь неё, а она запищала.xxx: Я думал, она вообще не работает.xxx: Бабушка-вахтёрша укоризненным голосом: ""Это потому, что на вас бахил нету!""";760
Цитата #12584; 12 апреля 2010 ;Андрей: Ты зачем меня добавил?Сафирот: Личная информация твоя понравилась.Андрей: Чем?Сафирот: Ты, оказывается, в моей квартире живешь.;759
Цитата #14378; 13 июля 2010 ;GRRemlin: Мля, уронил терабайтный HDD и поймал в десяти см. от пола. За секунду все файлы с этого HDD пронеслись у меня перед глазами...;759
Цитата #13528; 29 мая 2010 ;"Семейная идиллия. Сидим: муж в 1С финансы разруливает, я у дочки задание проверяю.Она мне: есть конь, нет коня, дать коню...Муж поворачивается с ухмылочкой: ""Дать коню?""Шикнула на него, едем дальше. Есть кость, нет кости, дать...Этот засранец, сгибаясь от хохота, перебивает: ""...Косте!""Прятался в туалете, пока я не остыла :->";758
Цитата #18049; 24 декабря 2010 ;xxx: По-моему, звонок будильника - это напоминание, что ты лежишь в неудобной позе!xxx: Cразу принял удобную и еще крепче заснул..;758
Цитата #15849; 20 сентября 2010 ;XXX: Здравствуйте. у меня принтер комкает бумагу =( можно что-нибудь с ним сделать?YYY: Поставить в туалет!;755
Цитата #31796; 11 июля 2012 ;"из ЖЖ:Это потом я понял, что соседи пришли именно ко мне, решив, что раз я учусь на программиста, у меня должен быть интернет, а значит я смогу найти то, что их интересует... Но поначалу я впал в легкий ступор, когда ко мне постучали и сказали: ""Юрочка, ты же программист? Нам тут надо кастрировать кота...""";755
Цитата #221; 30 ноября 2007 ;xxxа у тебя то что в паспорте?..yyyВитяxxxа почему в инфе написано, что Рома?yyyопечатка;754
Цитата #31142; 18 июня 2012 ;Orange: ко мне пришла толькочто моя любимая девушка, сказала, что выходит замуж, благодарит за всё, желает удачи, попутного ветра, подарила две бутылки Джека Дэнилса и попросилась в ванную. Сидит там уже полчаса. Что делать?;753
Цитата #16418; 12 октября 2010 ;веселая у меня девушка...д: поможешь мне сегодня физику сделать?я: попробую, я правда ее плохо понимаю.д: да там легко. я тебе объясню;752
Цитата #17874; 16 декабря 2010 ;ххх: кто у трезвого на уме, тот у пьяного в исходящих :);752
Цитата #16768; 25 октября 2010 ;xxx: на днях ходила к косметологу на чистку. почистили меня, потом маску нанесли с запахом водорослей, оставили меня минут на 20, музыку-релакс включилиxxx: я лежу будто в болоте: темно, на лице какая-то дрянь с запахом гнилья и птицы поют над ухом;750
Цитата #16887; 29 октября 2010 ;xxx: а можно в настройках почтового ящика указать размер члена, чтобы не слали спам по увеличению?;750
Цитата #293; 2 декабря 2007 ;"xxxx: Я люблю Россиюxxxx: Вчера иду себе вечером,никого не трогаю.xxxx: Тут удар ногой в спину, падаю лицом вниз, лежу, подбегают 2 омоновца, переворачивают меня, и со словами: ""Не, не он"", садятся в машину и уезжают...";747
Цитата #18227; 1 января 2011 ;xxx: Не дождусь, когда соцсети проберутся в автомобили. Обогнал такой пробку по обочине и бац: «14 человек считают, что вы хуйло».;746
Цитата #1084; 3 сентября 2008 ;Чем вкуснее пельмени, тем херовее жызнь.;744
Цитата #32181; 26 июля 2012 ;Поставила курицу в духовку, пошла укладывать ребёнка спать.Мужу говорю: последи, как запахнет - убавь, через 15 минут достань.- Ага, хорошо.Через час прибегаю на кухню - курица горит. Муж за компом.Немая сцена. Кхм.Слова мужа цитирую:- Я сижу играю, чувствую, что вкусно пахнет. Думаю, сейчас пойду поем. Потом запахло горелым невкусно и я передумал.;740
Цитата #32703; 16 августа 2012 ;Была такая история, через 3 дня день строителя, шеф поручил найти, кто сможет на кирпиче вырезать поздравление, ну очень хотел выделиться таким подарком. Начинаю искать, гуглить, никто не делает это. Потом допёрло позвонить в изготовление памятников.xxx: Здравствуйте, такой вопрос, вы занимаетесь гравировкой кирпичей?yyy: У вас что, мышь умерла?;740
Цитата #31186; 19 июня 2012 ;olga98: А какой пин на твоей карте?roman83: Тебе ЭТО в общем чате писать? Ща отэсэмэсю.olga98: НЕ! я у мамы телефон забыла! зааай???roman83: Ладноа. Давай по цифрам. Первая - вторая цифра нашей квартиры. Вторая - четвертая твоего телефона. Третья - 4. Последняя - последняя марки твоего ноута. ок?olga98: поняла. а ты хитрый! 8342, так?;739
Цитата #11008; 18 января 2010 ;ххх: У нее в глазах какая-то искорка есть :)ууу: По-моему, ее тараканы в голове какой-то праздник справляют и это салют...;738
Цитата #16333; 8 октября 2010 ;"irrra07:вчера братику объясняла женскую психологию. В полдвенадцатого ему смс приходит от его девы, он мне читает ""А я уже спать легла"" и спрашивает - что она этим хотела сказать?Я - ну, она хотела сказать, что уже полдвенадцатого, а ты ей не позвонил и не написал пожелать спокойной ночи и всего остального. А еще это значит, что если ты не ответишь, она сама тебе перезвонит минут через 10, ибо не выдержит.Пяти минут не прошло и она звонит....";738
Цитата #30465; 27 мая 2012 ;"ххх:Я сегодня с треском провалил ОБЖууу:Как ты умудрился?ххх:Там вопрос был:""В случае пожара,какие шаги вы предпримете?""ххх:Очевидно, ответ ""неебически большие"" был неверный.";738
Цитата #381; 6 декабря 2007 ;Я: В пятницу, если все получится, то у меня будет секс с обалденной девушкой!!!Она: О_оЯ: Упс. Это не тебе!Я: Это про тебя :-[;735
Цитата #1391; 14 сентября 2008 ;Папасос кольких до каких ты завтра учисяКрошка Енотс 8.30 до 15.40 в пятницу так жеПапаа в субботуКрошка Енота в субботу свадьбаПапау кого?Крошка Еноту нас c Митей блин!!!)))))))))Папау где? у хто?Крошка Енотпапа..возможно для тебя это станет неожиданностью,но я выхожу замуж.Папахто разрешил?Крошка Енот*ROFL*;735
Цитата #18485; 14 января 2011 ;DON: Политическая экономия. Учебник. — П.издат.DON: хороший учебник.;735
Цитата #29724; 24 апреля 2012 ;"Приехал я как-то на заправку. Жена с ребенком сидит на заднем сидении. Вставил пистолет, стою жду, о чем-то думаю. В это время жена вышла из машины с другой стороны отвести ребенка в туалет. Я, не заметив этого, заправил машину, сел и уехал как ни в чем не бывало. Еду, значит, а тут мне жена на мобильник звонит. Я сбрасываю звонок и говорю вслух: ""Хватит придуриваться, не отвлекай"". Она звонит мне еще раз, я смотрю в зеркало заднего вида и тут до меня доходит..";733
Цитата #11711; 25 февраля 2010 ;девочка (д) только что отправила парню (п) свою фотографию.д: ну как, только честно?п: ну... зато в тебя монетки кидать не будут...д: в смысле?!п: в смысле - не фонтан.;730
Цитата #11181; 28 января 2010 ;[Ц@Rь]: у меня иногда возникает ощущение, что когда ты смотришь на торрент, то он стесняется и скорость загрузки падает.;729
Цитата #31227; 20 июня 2012 ;До чего доводит дипломЗвонит на сотовый одногруппник.О: позвони мне на мобильный, я что-то нигде его найти не могу...Я: в руках смотрел?О: в смыс... блять. пока.;727
Цитата #32864; 23 августа 2012 ;xxx:сейчас во дворе видел мальчика, у которого на челе написано быть идеальным начальником. Дети играют, он сидит наблюдает. Вдруг:-Эй, пацаны! Идите сюда кто-нибудь один!один подходит.-Чо?-Позови остальных!;724
Цитата #28481; 13 марта 2012 ;Работаю в поддержке одного оператора мобильной связи, раннее утро, в трубке молодой женский голос, говорит шепотом:- Девушка, помогите, я назову номер, а вы мне скажите как владельца зовут, а то он вот сейчас проснется, а я не знаю как к нему обратиться...;723
Цитата #14116; 29 июня 2010 ;xxx: мой сосед по даче занимается установкой входных дверей, у него старых железных просто море, он из них забор соорудилxxx: щас у него любимое занятие - смотреть, как гости к нему сначала попасть пытаются, а потом - выйти;722
Цитата #12539; 9 апреля 2010 ;xxx: я сегодня доброе дело сделалyyy: Что на этот раз?xxx: на вокзале бежал, смотрел на табло и нечаянно задел плечом девушкуxxx: она уронила бутылку пива и выронила сигаретуxxx: чувствую себя просто героем;721
Цитата #32470; 7 августа 2012 ;он: уруруруру, ты такая милая, такая киса, прям аняняняняняняня и даже мимимиона: эк тебя распидорасило;713
Цитата #17995; 22 декабря 2010 ;1: помнишь, я у местных гопов парнишку избитого выкупила за полтинник? пожалела, дура!2: почему дура-то?1: они ко мне вторую неделю ходят как на работу. приносят парней, предлагают купить. и говорят: не стесняйся! не нравится этот, скажи - другого принесем (;711
Цитата #32549; 10 августа 2012 ;Интернет-викторинаЗнайка: бог еды и плодородия у народов крайнего севера? (8 букв)SataNuna: вертолет;710
Цитата #32855; 23 августа 2012 ;xxx: Сегодня увидел таракана, схватил какой-то журнал со стола и...xxx: Это был первый в мире таракан, попавший на обложку Forbes )));706
Цитата #30880; 10 июня 2012 ;xxx: Здрасьте. Майские добили организм. Наездился по врачам. Убил всё что можно. Пытаюсь вырваться. Тяжко пиздец.Две недели не пил, вроде полегче стало. Но пару соток выпил и опять жопа. Давление и вся хуйня. А впереди чемпионат Европыyyy: Только не говори что ты в Сборной;705
Цитата #30069; 11 мая 2012 ;"Макс: сегодня иду по улице, навстречу чувак в футболке с надписью ""Если хочешь меня - улыбнись""Макс: никогда я ещё не прилагал столько усилий, чтобы сохранить серьёзное лицо";704
Цитата #16453; 13 октября 2010 ;"ххх: Девиз женщин: Мужчины - линолеум. Если его первый раз хорошо постелить, то по нему можно ходить 20 лет.ууу: Ну хорошо, почувствовал унижение мужского пола. Вот тебе: девушки как ламинат, не клеится - забей!zzz: Это называется ""битва полов""";699
Цитата #30381; 24 мая 2012 ;xxx: не, ты не понял. Безмен действительно ебнутый. он купил телефон на рынке за 200р чтобы (внимание) ПРИВЯЗАТЬ ЕГО К ПУЛЬТУ и звонить когда тот теряецо!ууу: он гений!!!;699
Цитата #15016; 11 августа 2010 ;xxx: Переживших лето 2010 будут выгонять из Ада.xxx: За смех в котле.;697
Цитата #16186; 4 октября 2010 ;xxx: у меня теперь есть семья - я, кот и одеяло.xxx: мы даже спим все вместе!;697
