Цитата №;Дата;Цитата;Рейтинг
['Цитата #13350', ' 20 мая 2010 ', ' добавлено:bash.org.ru'];20 мая 2010 | д;ххх: я противозачаточные не пью по той простой причине, что они гормональные и меня может разнести в разные стороны. Поэтому пользуюсь свечками.ххх: Помолилась и в путь?;1297
['Цитата #17167', ' 13 ноября 2010 ', ' добавлено:bash.org.ru'];13 ноября 2010 ;xxx: пропущенные вызовы: Папа(1), Брат (1), Мама(48);1297
['Цитата #1369', ' 14 сентября 2008 ', ' добавлено:bash.org.ru'];4 сентября 2008;Начал резаться зуб мудрости, в это время перекрасилась в блондинку. Зуб рости перестал. Мне кажется он о чем то догадывается.;1295
['Цитата #16150', ' 3 октября 2010 ', ' добавлено:bash.org.ru'];3 октября 2010 ;"Koleso: сегодня наблюдал чудную картину: бабуля ""таблеткой"" для домофона тыкала им по кнопкам набирая номер квартиры и кнопку вызова. на вопрос ""кто?"" ответила ""я бабушка"",в ответ гневная тирада: ""когда же ты блин начнешь электронным ключом пользоваться"". бабуля в том же тоне ""а я по-твоему как звоню?!""Koleso: я даже не стал пытаться разрушать это семейную идиллию...";1278
['Цитата #17868', ' 16 декабря 2010 ', ' добавлено:bash.org.ru'];16 декабря 2010;"Пашу вчера уволили. ну ты знаешь, который невезучий2 недели назад его невезение превысило критическую массуну ты знаешь нашего директора - лилипутну вот, этот мэн в костюме из Детского Мира чихнул. весь опен-офис сказал ""Будь здороффф!""и только наш Паша, не заметив кто чихнул, добавил ""расти большой!""";1277
['Цитата #12698', ' 17 апреля 2010 ', ' добавлено:bash.org.ru'];17 апреля 2010 ;Max: Эх... Россия!Max: К Серёге вчера двое ребят приходили, с целью обидеть. Что-то предъявляли, предъявляли. Серёга им морду набил обоим. Эти двое пожаловались каким-то своим друзьям и к Серёге пришёл мордоворот с собакой(!) на разборку. Серёга его тоже измесил и до кучи собаку отхерачил по-полной. Тот стрелку уходя забил. Серый сходил на стрелку, и там кому-то ещё по-морде дал. А потом выяснилось что все они квартирой ошиблись и им совсем не этот Серёга был нужен, а тот, что из 69кв. Но судя по всему, наш Серёга уже отбил у них желание искать кого-либо в этом доме...;1276
['Цитата #11096', ' 24 января 2010 ', ' добавлено:bash.org.ru'];24 января 2010 ;xxx: Сначала хвалимся, что нихера не учили и охуенно сдали сессию.xxx: Потом, что нихера не работаем и получаем херову кучу денег.xxx: Затем жалуемся, что платим херову кучу денег каким-то долбоёбам, которые нихера ничего не делают.;1272
['Цитата #367', ' 6 декабря 2007 ', ' добавлено:admin'];декабря 2007 | ;у меня случай был 1 ) У парня инет пропадал на 5 мин каждые 10 минтак оказалось, что пьяные админы дёргали провод и делали ставки, кто первый позвонит );1271
['Цитата #14385', ' 13 июля 2010 ', ' добавлено:bash.org.ru'];13 июля 2010 | ;"Cyberpunk: самая популярная первая фраза в любом походе: ""А знаете, что мы забыли?!""";1264
['Цитата #11651', ' 21 февраля 2010 ', ' добавлено:bash.org.ru'];21 февраля 2010;"xxx: Обожаю читать студенческие лекции )yyy: Что такое?xxx: полчаса уже плачу над сокращением подруги в тетради по бухучету: ""бух-ие орг-ии""";1253
['Цитата #10106', ' 26 ноября 2009 ', ' добавлено:bash.org.ru'];26 ноября 2009 ;ххх: помнишь, ты писал, что если в колу добавить растворимый кофе, то не уснешь?yyy: ну да,а что? )ххх: СУКА! КОНЕЧНО НЕ УСНЕШЬ, КОГДА ПОЛ-НОЧИ КУХНЮ ОТТИРАЕШЬ ОТ ЭТОЙ ПЕНЯЩИЙСЯ ХЕРНИ С КОФЕ!!!;1236
['Цитата #28424', ' 11 марта 2012 ', ' добавлено:bash.org.ru'];11 марта 2012 |;Муж купает ребёнка, кричит из ванной:- Кать, он ест пену!Через пару минут:- Кать, она реально вкусная!;1224
['Цитата #17609', ' 5 декабря 2010 ', ' добавлено:bash.org.ru'];5 декабря 2010 ;отличие мужской и женской логики:живу с женой и бабушкой. бабушке под 90 лет. переехали к ней в этом году, т.к. некому ухаживать. условия проживания всю ее жизнь были такие: чсктор с удобствами во дворе. мы с женой подсуетились, достроили ванную и туалет. ударил морозец, но бабушка по привычке ходит по своим делам на улицу, хотя я ей триста раз обьяснял, что можно дома (бабуля плохо ходит и пару раз падала во дворе). я разговаривал с ней сам, т.к. бабуля моя. но психика моя уже устала от нервных потрясений и я обратился за помощью к жене. она даже не пошла с ней разговаривать. она просто постирала обе бабушкины куртки. за 2 дня что они сохли, бабуля адаптировалась.;1219
['Цитата #952', ' 25 августа 2008 ', ' добавлено:bash.org.ru']; августа 2008 |;polinagromova: Решила порадовать блин любимого. Повелась на уговоры мастера в салоне и сделала интимную стрижку. То есть не эпиляцию, а именно что стрижку. Цветочек! Со стразами. Короче в результате у него не встало, он начал истерично ржать и сказал что не может заниматься ЭТИМ с клумбой :( Сижу, отколупываю стразы;1210
['Цитата #12902', ' 27 апреля 2010 ', ' добавлено:bash.org.ru'];27 апреля 2010 ;xxx: Сегодня вживую видел один из самых быстрых каналов передачи данных: 2 гига в секунду!xxx: Пылесос засосал флешку :D;1206
['Цитата #16359', ' 9 октября 2010 ', ' добавлено:bash.org.ru'];9 октября 2010 ;Сегодня видел образец святой невинности. Клиент, мужик лет под 40:М: И еще мне нужно, чтобы вы заблокировали мне на компьютере выход на один сайт. Чтобы ребенок не залез.Я: Что за сайт?М: Ну... Порно.Я: А какой именно?М(с паникой в глазах): А что, их несколько???;1202
['Цитата #11638', ' 20 февраля 2010 ', ' добавлено:bash.org.ru'];20 февраля 2010;xxx: Саша, с тебя 300 р.xxx: Ольге отдашьyyy: За что?xxx: на днюху чью-то скидываемсяyyy: Я те по секрету скажу... Это моя днюха;1197
['Цитата #20018', ' 28 марта 2011 ', ' добавлено:bash.org.ru'];28 марта 2011 |;RomAndry:Знакомый не давно получал несколько поломанных iPhone 3G (на запчасти).На таможне решили «нагреть руки» в наглую выписав ему счет на растаможку как за новые iPhone 4G.Он ни слова не говоря, пошел в банк, оплатил, взял свидетелей и пошел в таможню.Там, отдав квитанции и получив груз возмутился: «Где мои новые 4G?!»Идет разбирательство. Знакомый получает новые 4G или компенсацию.Урок он преподал хороший — на заметку тем, кто получает и растомаживает.;1197
['Цитата #17160', ' 13 ноября 2010 ', ' добавлено:bash.org.ru'];13 ноября 2010 ;ХХХ: ты мне какой та паленный офис скинул, у мну там ни один файл не открываеца (((ууу: а расширение файлов какое?ххх: docxyyy: ты в 2007-ом их что-ли делала?ххх: нет вчера;1189
['Цитата #11064', ' 22 января 2010 ', ' добавлено:bash.org.ru'];22 января 2010 ;Она: расскажи мне сказку на ночьОн: зай, я сам одна сплошная сказкаОна: даже не знаю, как спросить: а конец у тебя плохой или хороший?;1175
['Цитата #565', ' 15 декабря 2007 ', ' добавлено:admin']; декабря 2007 |;"ZZZ ну а опиши как они внешне! она точнее. ты ее на кофе вытаскивал?ХХХ Митя, я ни в чём не уверен, я был пьян в жопу. Нет, мы в компании случайно встретилисьZZZ :-D внешне то что собой представляет?ХХХ Одно могу сказать точно. Она не отталкивающая и опрятная. На крепкую 4 по 5 балльной. Ну и показалось, что домашняяZZZ как колбаса… знаешь Женя, это все говорит о том, что НЕ ДАСТХХХ Но есть одно ""НО""ZZZ какое но? у нее член?ХХХ Нет. Хуже. По состоянию на вчерашний день она не читала ""Братья Карамазовы""ZZZ Брат, не хочу тебя расстраивать.....может ты отвернешься от меня после моих слов....НОЯ ТОЖЕ НИ ХУЯ НЕ ЧИТАЛ! КАРАМАЗОВЫХХХХ Митя, я тебя никада, слышишь, никада ебать не собирался";1166
['Цитата #17469', ' 28 ноября 2010 ', ' добавлено:bash.org.by'];28 ноября 2010 ;"<DeadMoroz> На работе ситуация понравилась сегодня... Зашли парень с девушкой, увидели нетбук... Девушка произносит ""Ой, какой маленький, совсем как у тебя..."" Еле сдержалсо, чтобы не заржать...";1151
['Цитата #15925', ' 23 сентября 2010 ', ' добавлено:bash.org.ru'];23 сентября 201;"Сегодня наша юристка подходит к принтеру, он не печатает.- Посмотрите принтер, он что-то не печатает - говорит мне.- Что-нибудь пишет на дисплее?- Да - говорит - ""Загр. бумагу"". ЗАГРЫЗЛО БУМАГУ кажется...";1150
['Цитата #326', ' 26 октября 2008 ', ' добавлено:admin']; октября 2008 |;Молодая парочка сидит в кинотеатре на последнем ряду. Он:- Мань, мы уже тут целый час сидим, а ты меня даже еще ни разу не поцеловала.- Вань, я же только что сделала тебе минет!- Мне???;1149
['Цитата #369', ' 6 декабря 2007 ', ' добавлено:admin'];декабря 2007 | ;"Lexus: ...А я вот не могу покупать этот вкусный копченый сыр в косичках...=ZDR=: Чего это?Lexus: Не, я, конечно, могу... только он, зараза, когда в рюкзаке потом лежит, шепчет оттуда, тихонько так: ""Остановись у ларьков, купи пива, давай же, купи пива!..""=ZDR=: ты РАЗГОВАРИВАЕШЬ с СЫРОМ??! о_ОLexus: Дебил что ли? каким нужно быть придурком, чтоб разговаривать с сыром! Я его игнорирую...:)";1147
['Цитата #18034', ' 23 декабря 2010 ', ' добавлено:bash.org.ru'];23 декабря 2010;xxx: и что, взяли тебя?yyy: конечно. такие спецы, как я, на дороге не валяются!xxx: ну да, а в прошлые выходные? )))yyy: ДА ВЫ ЗАЕБАЛИ УЖЕ ВСЕ!!!;1140
['Цитата #11555', ' 16 февраля 2010 ', ' добавлено:bash.org.ru'];16 февраля 2010;xxx: Я две недели кошку наказывал за лужи в туалете, а оказалось - бачок протекает (;1136
['Цитата #10784', ' 4 января 2010 ', ' добавлено:bash.org.ru'];4 января 2010 |;Sidor: вчера какой-то пьяный парень у меня попросил рубль, я ему дал 5 рублей, а он сказал, что я отличный парень и дал 40 рублей;1132
['Цитата #17153', ' 13 ноября 2010 ', ' добавлено:bash.org.ru'];13 ноября 2010 ;xxx: она вчера второй знак прилепила :-Dxxx: ну желтый восклицательныйyyy: зачем второй то?xxx: ей показалось, что окружающие водители недооценивают угрозу;1120
['Цитата #15988', ' 27 сентября 2010 ', ' добавлено:bash.org.ru'];27 сентября 201;Хап: Отличия русского и европейца.Когда все нормально, европеец спокойно и хорошо работает, а когда все идет через жопу - паникует.Когда все идет через жопу - русский мобилизуется и делает невозможное. Когда все хорошо - русский страдает хуйней.;1119
['Цитата #16038', ' 29 сентября 2010 ', ' добавлено:bash.org.ru'];29 сентября 201;roman : есть юристы знакомые толковые?S_Style : какое право интересует?roman : конфликты с работодателем - это какое право?S_Style : крепостное;1116
['Цитата #968', ' 26 августа 2008 ', ' добавлено:bash.org.ru']; августа 2008 |;захожу в супермаркет краем уха слышу диалог тетки и охранникаТ:Слушай а как к вам на работу в охранное агнство устроится?О:В смысле?Т:ну там есть какие то критерии отбора или нету?О:А вы че хотите охранником устроится?Т:НЕТ МНЕ ПРОСТО ИНТЕРЕСНО КАК ТАКОГО МУДАКА КАК ТЫ НА РАБОТУ ВЗЯЛИ!;1113
['Цитата #17731', ' 10 декабря 2010 ', ' добавлено:bash.org.ru'];10 декабря 2010;Суровые российские монтажники: получили задание от начальника установить лампу освещения на входе в здание с автоматом выключения. Есть такие, вырубающие ток в светлое время суток. Собрали, подключили, а так как на дворе светлый день, то проверка прошла на ура. Закрыли датчик шапкой - темно. Лампа включается. Сняли шапку с датчика - светло. Лампа выключается. И с чувством выполненного долга ушли домой. Самый цирк начался поздно вечером, потому что датчик монтажники закрепили прямо над лампой. Всю ночь у дежурного была дискотека: стемнело - датчик лампу зажег, лампа зажглась и стало светло, а стало светло - датчик лампу гасит, ой опять темно - датчик лампу зажигает .... и так от заката до рассвета.;1113
['Цитата #10946', ' 15 января 2010 ', ' добавлено:bash.org.ru'];15 января 2010 ;xxx: смотрю на коллегуxxx: стоит, наливает чай, кружку под наклоном держитxxx: наверно, чтоб не пенилось...xxx: хорошо человек отдохнул %);1106
['Цитата #14526', ' 19 июля 2010 ', ' добавлено:bash.org.ru'];19 июля 2010 | ;Arsis: щас вот посмотрел на клавишу Q на клавеArsis: очень интересная клавиша :)Arsis: 2 буквы, а какой смысл;1105
['Цитата #32976', ' 29 августа 2012 ', ' добавлено:bash.org.ru'];29 августа 2012;"xxx: Родители уехали в Италию. Каждый день пишут письма. Сегодняшнее подписано: ""С приветом из Ватикана. Целую. Папа""";1105
['Цитата #16096', ' 1 октября 2010 ', ' добавлено:bash.org.ru'];1 октября 2010 ;ххх: вот скажи честно что ты ко мне испытываешь?ууу: Терпение.;1100
['Цитата #10388', ' 10 декабря 2009 ', ' добавлено:bash.org.ru'];10 декабря 2009;"Малышка: сегодня он упал передо мной на колени =)Малышка: и громко сказалМалышка: ""ёбаный лёд!"" (";1097
['Цитата #20410', ' 11 апреля 2011 ', ' добавлено:bash.org.ru'];11 апреля 2011 ;xxx: Костя ты любишь свою работу?yyy: Мы любим свою работу!yyy: Труд есть дорога к благоденствиюzzz: боишься, что сисадмин шпионит?yyy: сисадмин не шпионит ОН САМЫЙ ЗАМЕЧАТЕЛЬНЫЙ ЧЕЛОВЕК В МИРЕ, КРАСОТА И УМ КОТОРОГО УСТУПАЮТ ЛИШЬ БОГАМ ОЛИМПА;1095
['Цитата #28883', ' 30 марта 2012 ', ' добавлено:bash.org.ru'];30 марта 2012 |;"Мальвина:Была с мужем в автосервисе. До сих пор под впечатлением!Подходит работник сервиса и без слов (кивком) интересуется ""Чё?"", муж: ""Да жопа ваще..."" и показывает пальцем на какую-то штучку. Работник сервиса склонился и смотрит. Из противоположного конца зала, другой работник сервиса, прокуренным голосом интересуется у первого: ""Чё там?"". Этот ему в ответ: ""Ну тут такая же хуйня, как и та хуйня *кивок в сторону другой машины*, только тут ваще пиздец."" с того конца зала ему отвечают: ""А-а-а-а... Ну, это тогда всю эту поебень целиком менять нахуй..."" И даже муж мой ""в теме"", на одной волне с ними, а я в шоке, потому, что не понимаю, как они все друг друга понимают?!";1095
['Цитата #11009', ' 18 января 2010 ', ' добавлено:bash.org.ru'];18 января 2010 ;xxx: Я, конечно, девушка от компов далекая, но жесткий диск от винчестера отличить смогу!;1093
['Цитата #16939', ' 1 ноября 2010 ', ' добавлено:bash.org.ru'];1 ноября 2010 |;"xxx: Сижу на работе, через удаленный доступ качаю дома ноутом торренты. После обеда обнаруживаю, что температура выросла градусов на 10 и держится. Закрадываются подозрения.xxx: Включаю скайп - так и есть, эта сука валяется на теплом ноуте еще и хвостом перед камерой периодически машет! Беру микрофон, записываю wav с названием ""Свалилнахуйбля"", отправляю на ноут, громкость на максимум и запускаю.xxx: Не, ноут он не уронил, и матрицу не покоцал, только шнур сетевой выдернул, когда рванул. Придушу дома сволочь.";1087
['Цитата #10796', ' 5 января 2010 ', ' добавлено:bash.org.ru'];5 января 2010 |;zloy-zloy: мы с Алешей сегодня на иксбоксе рубились, потом в маке поели, потом ему новый телефон купили и два часа с горок в нескучном саду на жопах катались.zloy-zloy: у Алеши завтра день рожденияzloy-zloy: он мой дед. ему будет 81 год;1077
['Цитата #16336', ' 8 октября 2010 ', ' добавлено:bash.org.ru'];8 октября 2010 ;Переписка по корпоративной почте в одной крупной фирме.Секретарь Настя: Уважаемые сотрудники! У нашего коллеги Михаила в понедельник день рождения, давайте скинемся ему на подарок! )))) Идеи подарков также приветствуются. Деньги приносить мне.Андрей: Настя, добрый день. Насколько я знаю, Михаил интересуется спортивными автомобилями. Предлагаю сброситься на Enzo, такой у него ещё нету.Секретарь Настя: Андрей, Идея отличная! Я правда в машинках не разбираюсь, но раз Вы советуете, то я согласна ))) Коллеги, нас в отделе 28 человек, если мы скинемся всего по 40 тысяч долларов, должно хватить.Иван: Друзья, Я с Мишей знаком не первый год, в его автопарке уже есть два Ferrari, вряд ли ему будет приятно получить третью. С другой стороны, у него есть маленькая дочь. Можем придумать что-то для неё, например Диснейленд.Секретарь Настя: Иван, вы знаете, я проверила, купить самый маленький дешевый Диснейленд в Новом Орлеане стоит от $7,000,000. Скинуться по триста тысяч долларов сейчас мы, конечно, можем, но до зарплаты осталось всего несколько дней, и не у всех есть такая карманная мелочь. Предлагаю, всё-таки, остановиться на машинке.Начальник: Хватит сотрудников баловать. Михаил - это тот новый уборщик? Подарите ему, как обычно, квартиру на Садовом и хватит. Конец обсуждения, работать.;1077
