Цитата №;Дата;Цитата;Рейтинг
['Цитата #867', ' 22 декабря 2007 ', ' добавлено:admin']; декабря 2007 |;Svettik: приветик, можешь мне пожалуйста лабораторную помочь решитьJon: првет...хочешь всю правду?Svettik: какую правдуJon: во 1 - когда ты говоришь помочь - это нихуя не помочь, а полностью решить, и еще начертить блок схему и обяснить как всё это работаетво 2 - уже на протяжении 3 месяцев как я с тобой знаком, решаю тебе каждую неделю по несколько лаб, задач и тд. Я часто ахуевал с этих задач, наверно потому что ты учишься в вышке и там такой уровень, а я в средухе.... Но я запрягал друзей, когда сам не мог разобратся в коде, писал на форумах, спамил в хабе даже,...бывало тратил несколько часов, сидел весь вечер, понимая что ты в этом нихуя не шаришь и тока на меня вся надежда. ПОтом я торчал(и сейчас даже до сих пор торчу) тем кто мне помог или ты хули думала всё так просто за спасибо? Да, ты мне всегда говарила огромное спасибо, смайлики там ставила и всякую хуйню. ДА, зачет по вышмату у тебя автоматом...зачет по дискретки у тебя автоматом...всё заебись я рад за тебя честно. Я конечно не требовал чтоб ты мне дала за эту всю помощь, ты же приличная девушка. Но блять даже не было при встречах накакой награды там или намека...просто блять как друзья...Svettik: У тебя неудачный день выдался?Jon: нет всё заебись, только решай сама свои ебнутые задачи;7282
['Цитата #1291', ' 11 сентября 2008 ', ' добавлено:bash.org.by'];1 сентября 2008;"Поточная лекция человек 90 сидит в аудитории.Лекцию по логике ведет препод лет так под 65 голос ужасно тихий и писклявый. Пол часа вводный курс в предмет. Пол потока   занимается чем хочет. И тут он говорит:- ""Индукция - это......и т.д и т.п"". Тут голос с задних рядов:- ""да, ну на хуй""!!!? Тут последовала тишина, а за ней пауза по кручи чем в ""Ревизоре"". Препод обводит глазами всю аудиторию и выдает мощнейшим голосом фразу:-""Я мужик в годах, пездеть не буду"". Наш смех он успокаивал минут 15 точно.....";6146
['Цитата #7259', ' 19 октября 2009 ', ' добавлено:bash.org.ru'];9 октября 2009 ;"Я в восторге от наших учителей.Сыну в школе дали домашнее задание, где, среди прочего, был вопрос ""как связаны буква 'А' и бык?""Рассказал ему про финикийский алфавит, как первую фонетическую письменность. Что там была буква ""алеф"", очень похожая на нашу современную ""А"", и что слово ""алеф"" означало ""бык"". Что, возможно, букву так назвали, потому что если развернуть ее, то она похожа на морду быка с рогами.Еще очень радовался, что детям во втором классе такие вещи рассказывают.Учительница поставила ребенку двойку, заявив, что он фантазировал в домашнем задании. А правильный ответ: если к слову ""бык"" добавить ""а"", получится родительный падеж.Я не планировал в таком раннем возрасте рассказывать сыну, что половина окружающих людей - идиоты, но, видимо, придется :-)";5518
['Цитата #12328', ' 30 марта 2010 ', ' добавлено:bash.org.ru'];30 марта 2010 |;у меня на балконе сосулька растет метровая, прямо над машиной, которая ссигналит каждую ночь. Я эту сосульку из распылителя подкармливаю.;5026
['Цитата #1265', ' 9 сентября 2008 ', ' добавлено:bash.org.ru']; сентября 2008 ;Она: У нас сегодня с утра 5 градусов всего былоОн: ОгоОна: Я дубу дала...Он: не знаю что ответить... согрелась хоть?;4896
['Цитата #12844', ' 24 апреля 2010 ', ' добавлено:bash.org.ru'];24 апреля 2010 ;Жук: Выведите меня из цикла, кто-нибудь. Плиз!Alien: Странная просьба... Обычно из запоя вывести просят, а ты из цикла. Из какого хоть цикла-то?Жук: Поссорился с женой (довела до предела), решил разрядиться и ударил кулаком стену, при этом выбил стекло в двери локтем на замахе, порезался, помирился с женой, пошёл покупать новое стекло, купил, но оно сцуко меньше чем надо, пошёл ещё купил стекло, разбил его пока домой нёс (нечайно), пошёл ещё купил стекло, принёс, установил (но оно херово как-то установилось), поссорился с женой, решил покурить на кухне, закрыл дверь, из неё выпало и разбилось стекло. Порезал ногу. Помирился с женой. Пошёл за новым стеклом... Мне продолжать свой грустный рассказ?;4653
['Цитата #16035', ' 29 сентября 2010 ', ' добавлено:bash.org.ru'];29 сентября 201;fint: вчера в чатрулет зашел, наткнулся на 2 англичанок по 16 летfint: одна пишет - о, недавно в школе про россию училаfint: я у нее - и что выучила? она - там холодноfint: потом спрашивает - ты аристократ или крестьянин?fint: сказал, что мы крестьянам не разрешаем в инете сидеть;4483
['Цитата #963', ' 26 августа 2008 ', ' добавлено:bash.org.ru']; августа 2008 |;xxx : хочешь я тебе цветы подарюyyy : ТЫ ЗАЕБАЛ СО СВОИМИ ЦВЕТАМИ , КОНФЕТАМИ , ШОКОЛАДКАМИ , НЕТ БЫ ПРОСТО ВЗЯТЬ И ВЫЕБАТЬ !xxx : ты меня обидела;4408
['Цитата #10059', ' 24 ноября 2009 ', ' добавлено:bash.org.ru'];24 ноября 2009 ;AnDro3d: Вопрос: в лоб ебаться будешь?AnDro3d: Извините, двоеточие не там поставил..;4157
['Цитата #16211', ' 5 октября 2010 ', ' добавлено:bash.org.ru'];5 октября 2010 ;"rastazom: шел с твоим лаптем (чинить), задумался, ничего не замечаю вокруг. Тут нападают на меня промоутеры билайнаrastazom: ""дешевый тариф"", все дела, возьмите буклетrastazom: я на автомате ""А вы знаете, что христос вас любит?"" и лезу в твой пакет, щас, говорю, я вам буклеты дамrastazom: они в затупе смотрят на меня. я говорю: ""да шучу, шучу... никто вас, блять, не любит""";3848
['Цитата #1183', ' 8 сентября 2008 ', ' добавлено:bash.org.ru']; сентября 2008 ;- я у подруги первый- чё, ничё не умеет?- ага, даже минет делать- ну так научи...- знаешь, я и сам не умею;3738
['Цитата #12011', ' 14 марта 2010 ', ' добавлено:bash.org.ru'];14 марта 2010 |;xxx: Мама как-то пошла за новой микроволновкой. Мальчик-консультант в Эльдораде рассказывал, как она крута: вентилятор волны разгоняетxxx: Бедняга не знал, что мама не только добродушная дама в возрасте, но и доебистый радиофизик;3646
['Цитата #16332', ' 8 октября 2010 ', ' добавлено:bash.org.ru'];8 октября 2010 ;"Работаю в ГАИ, оформляем ДТП, нужно остановить понятых. Останавливаю машину, представляюсь, говорю мол такая ситуация, вы не могли бы побыть понятым у нас, много времени не займет. Водитель отвечает ""неее я не могу, у меня с собой документов нету ...пауза... БЛЯЯЯЯЯЯЯЯЯ""";3634
['Цитата #10818', ' 7 января 2010 ', ' добавлено:bash.org.ru'];7 января 2010 |;Она: Костик, такие вещи по асе не говорят, но я ...Она: я беременна...Она: аауу, ты рад?Она: Костик?Он: его нет, он отошел.Она: ой. а кто это?Он: судя по всему уже бабушка;3598
['Цитата #1146', ' 7 сентября 2008 ', ' добавлено:bash.org.ru']; сентября 2008 ;Звонок...П-пользовательА-админП-Здравствуйте, у меня проблема.А-Какая ?П-У меня интернет маленькийА-эээмм сейчас посмотрю (Предвкушая что-то очень весёлое пошёл смотреть)П-Ну вот смотрите.. (Эксплорер развёрнут только на половину рабочего стола)А-Эмм.. (клик мышкой на Развернуть)П-Воо большой интернет..;3477
['Цитата #1121', ' 5 сентября 2008 ', ' добавлено:bash.org.ru']; сентября 2008 ;На работу как на празднег... Весело позвякивая кандалами;3444
['Цитата #375', ' 6 декабря 2007 ', ' добавлено:admin'];декабря 2007 | ;//разговор уволеного програмера и его бывшего начальникаxxx: и всетаки вы далпаеп...yyy: Дурак вы Алексей, вот когда будут звонить с вашей новой работы за рекомендацией - я им очень красочно вас опишу.xxx: сосите! я устраиваюсь в налоговую и тоже очень красочно им вас опишу;3384
['Цитата #16095', ' 1 октября 2010 ', ' добавлено:bash.org.ru'];1 октября 2010 ;"xx: Мне сейчас спам пришел ""Я живу в доме напротив, вот моя ссылка *адрес ссылки*. Давай познакомимся"". Я ответил, что живу напротив морга и меня пугают такие знакомства";3380
['Цитата #1322', ' 12 сентября 2008 ', ' добавлено:bash.org.ru'];2 сентября 2008;"Вчера, картина, в метро на Тургеньевской.Сижу, жду жену.Подъезжает поезд, как обычно народу много, 6 часов вечера.И вот все зашли и один мужик подбегает к двери последний и резко останавливается.Я вижу по лицу, что он завис что бы чихнуть, да и видно, что простывший.Ну он естественно очень сильно и от души чихает и в это же время закрывается дверь в вагон и мужик не успевает. А на дверях вагона, на стекле, висит реклама ""NOD32 ESET""Мужик смотрит на неё, достаёт платок, вытирает нос и выдаёт.""Ну да.. хуле.. антивирус.. Понимаю!""";3203
['Цитата #16244', ' 6 октября 2010 ', ' добавлено:bash.org.ru'];6 октября 2010 ;Stanislav: Так вот, конфуз. Еду домой в переполненном автобусе, пару из которых тупо проехали. Сжали со всех сторон. Слушаю музыку, пытаюсь не нервничать. Тут чую правое ухо выпадает, поскольку какая то бабка провод что к плееру зацепила. Ну я уже и так и сяк, короче выпало. В одной руке рюкзак, другой держусь на поручень. На светофоре резко отпускаю поручень и начинаю наушник искать, нащупываю провод, дергаю, а наушник зацепился собака, дергаю сильнее, попадает мне в руку, запихиваю его в ухо и офигеваю того что в разных ушах играет РАЗНАЯ музыка.Stanislav: Ну и нависающий надо мной с искренним удивлением араб какой-то.Stanislav: С его точки зрения еще забавнее все. Стоит какой то толстожопый русский, потом у тебя из уха вырывает наушник, вставляет его себе а потом на тебя пялится. Нужно было еще добить просьбой поставить че-нить прикольное.;3168
['Цитата #1408', ' 15 сентября 2008 ', ' добавлено:bash.org.ru'];5 сентября 2008;"PblCb: недавно спам раздавали у метро со словами ""вот какая-то хуйня тут"".не смог не взять.";3145
['Цитата #942', ' 23 августа 2008 ', ' добавлено:bash.org.ru']; августа 2008 |;"Встретилось слово ""скарификатор"". Решил поглядеть, что это, вбиваю в Вики.""Скарификатор — инструмент для скарификации перикарда, рабочая часть которого имеет зубчатую нарезку""Ояебу, я так и думал.";3044
['Цитата #12823', ' 23 апреля 2010 ', ' добавлено:bash.org.ru'];23 апреля 2010 ;х: БЛЯТЬ ТЫ КАКОВА ХЕРА ФОТКИ ВЫЛОЖИЛ ???!!!х: МНЕ РОДОКИ ТАКИХ ПИЗДУЛЕЙ НАВЕШАЛИ!!!х: УВИЖУ ТЕБЯ УБЬЮ СУКУ!!!!!у: кись 2 вопросау: 1 какие фотки именно ???х: ТВОЙ ДР !!!у: 2 как предки унали что это ты ????????х: ОНИ РОДИТЕЛИ И ЗНАЮТ ГДЕ У ИХ ДОЧЕРИ РОДИНКА НА ЖОПЕ!!!! ПОНЯЛ ОСЕЛ!!!!;2999
['Цитата #1156', ' 8 сентября 2008 ', ' добавлено:bash.org.ru']; сентября 2008 ;"Работаю в салоне связи. Заходит сегодня к нам святой отец. Причем огромных размеров. Рост более двух метров, весом не менее 180 кило. Денег хотел на телефон положить. Я ему объясняю, что по техническим причинам сейчас не могу ему помочь и предлагаю положить деньги, через платежных терминал.Он пару секунд подумал и выдает: ""Недоверяю я ему. в случае чаго ему ни в глаз ни дать, ни отпеть""";2956
['Цитата #16803', ' 26 октября 2010 ', ' добавлено:bash.org.ru'];26 октября 2010;"yyy: Хай. Купил айфон, четверку.xxx: А старый загнал уже?yyy: Неа. Так с двумя и хожу.yyy: Тут еду с деревни, везу в двух сумках картофан, сам одет ""с картошки"", напротив садится и благоухает все из себя кисо. Достает свой айфон и начинает его так ненавязчиво всем так демонстрировать - и фотки посмотрит, и плеер включит.yyy: Тут я лезу в сумку с картошкой и достаю тоже айфон. Говорю вполголоса ""Блин, не тот"", лезу и достаю второй. Надо было видеть ее лицо.";2930
['Цитата #16214', ' 5 октября 2010 ', ' добавлено:bash.org.ru'];5 октября 2010 ;xxx: В командировке на съемной квартире нужна была марля, чтобы погладить футболку. Начал шариться по всем ящикам. Марлю не нашел, зато нашел ключ в шкафу между простынями. Вспомнил, что один ящик в этом шкафу был заперт. Попробовал открыть его найденным ключом. Открыл. Внутри нашел марлю. Не зря в квесты играл..;2906
['Цитата #1416', ' 15 сентября 2008 ', ' добавлено:bash.org.ru'];5 сентября 2008;друг рассказал:у знакомого родители уехали на дачу, оставили денег и полный холодильник еды. Он приходит домой, заглядывает в него, еды нет, только банка варенья и запеканка.Потом заходит в комнату, видит, что ноута нет, фотоаппарата и тд, понял, что их грабанули.Звонит маме, рассказывает.Реакция мамы (обиженно):-Я не поняла, а чё это мою запеканку не упёрли?! У меня вкусная запеканка...;2684
['Цитата #14272', ' 8 июля 2010 ', ' добавлено:bash.org.ru'];8 июля 2010 | д;Говорят, от поноса морковь помогает.Боюсь представить, каким образом.;2339
['Цитата #12541', ' 9 апреля 2010 ', ' добавлено:bash.org.ru'];9 апреля 2010 |;"С форума:Вышел я из своего кабинета в соседний на 5 мин. и в этот момент ко мне зашел сотрудник службы безопасности предприятия. Увидев, что меня нет на месте, он отключил принтер и унес в свой кабинет и начал писать служебку, что сотрудник айти отдела за халатность, а именно за открытую дверь в кабинете, должен быть оштрафован на 5% оклада.Меня это не на шутку встревожило. Охраняемый этаж. Вход на этаж по пропускам. На этаже работает 25 человек, которых я прекрасно знаю и больше никого постороннего окромя начальства на этаж не заходит. Вынести ничего не возможно ибо охрана. Везде по коридору камеры наблюдения. Комп через минуту паролится. Двери во время работы никто никогда не закрывал. Поэтому пожаловался начальству. Мне же начали объяснять, что айти отдел самое уязвимое место ""ПОЧЕМУТА"".45 мин. назад зашел в пустой кабинет к службе безопасности и отключил 2 монитора и вынес в свой кабинет.В данный момент меня пытаются лишить еще 5%.";2332
['Цитата #1300', ' 11 сентября 2008 ', ' добавлено:bash.org.ru'];1 сентября 2008;Седня из окна универа увидел чьи-то шпоры.. Нацарапанные на дверях гаражей :D;2319
['Цитата #10304', ' 6 декабря 2009 ', ' добавлено:bash.org.by'];6 декабря 2009 ;"Попробуйте ввести в гугле ""лучший антидепрессант"". Первая ссылка обнадеживает.";2315
['Цитата #1157', ' 8 сентября 2008 ', ' добавлено:bash.org.ru']; сентября 2008 ;Из форума:xxx: ребят, такая проблема: мне в последнее время никто не верит!yyy: да не может быть, чтоб СОВСЕМ НИКТО не верил!ххх: спасибо, млять...;2249
['Цитата #1256', ' 9 сентября 2008 ', ' добавлено:bash.org.ru']; сентября 2008 ;"Да-да-да, я знал его ещё в НикольскеБолее тупой и злой детины, пожалуй, не встречалПомню, я его спросил, почему он даже на малейшую критику в свой адрес отвечает агрессивными выпадами с угрозой физической расправыОн почесал репу, погрозил мне кулаком и сказал ""Ща ведь ёбну!""";2224
['Цитата #1140', ' 7 сентября 2008 ', ' добавлено:bash.org.ru']; сентября 2008 ;xxx:У меня в супе что-то плавает!Оо.yyy: Это суп.Там всегда что-то плавает.xxx:Да,но оно кролем плавает!!yyy: хDD;2218
['Цитата #1228', ' 9 сентября 2008 ', ' добавлено:bash.org.ru']; сентября 2008 ;base (23:04:13 4/09/2008):на днях щелкал каналы ночью и наткнулся на очередной развод где из букв слова составляютbase (23:04:58 4/09/2008):так там предлогали угадать слово из трех рэндомных составляющих: тихо, анал и писик.base (23:05:26 4/09/2008):даже ведущий некоторое время был в ахуе и нервно косился на людей за кадром о_О;2127
['Цитата #11568', ' 17 февраля 2010 ', ' добавлено:bash.org.ru'];17 февраля 2010;"ххх: ехала на маленьком подъемнике. попросила мне сообщить, когда отцепляться, отцепилась раньше и поехала назад.ххх: врезалась в другой подъемник, потом меня догнал еще один, я как раз в позе раком цеплялась руками за снег...ххх: ударилась о чей-то ботинок, потеряла одну лыжу и на одной лыже покатилась в лесок.ххх: а смотритель в валенках и ушанке бежал за мной с криками: ""Девушка, в лес нельзя"", а я, чуть не рыдая, кричала: ""А я туда и не хочу""... и ехала, и ехала...";2115
['Цитата #233', ' 30 ноября 2007 ', ' добавлено:admin']; ноября 2007 | ;xxx: сижу в машине гаи, он молчит и я молчуxxx: тут он говорит: что ты мне ничего не предлагаешь?xxx: Я ему: выходи за меня!xxx: Он поржал и отпустил....;2050
