Цитата №;Дата;Цитата;Рейтинг
Цитата #32978; 29 августа 2012 ;"PAV: Давно пора уяснить, что в России три возможных причины повышения цен на топливо:- растут цены на мировых рынках: цена внутри страны тоже растет, т.к. приводится к общемировой;- снижаются цены на мировых рынках : цена внутри страны растет, т.к. нефтяники стремятся компенсировать потери на внешних рынках за счет внутреннего;- сезонное повышение цен: зимой в связи с холодами, весной в связи с началом посевной, летом в связи с массовым потреблением транспортом, осенью в связи с началом уборочной.";597
Цитата #1247; 9 сентября 2008 ;Antee:Пипец!!!Дома отключили всю воду!!!Двже в сортире воды нет, смывать нечем!!!Мама сидит на кухне ест арбуз, мы с братом в комнате пиво пьем...;596
Цитата #15048; 12 августа 2010 ;"xxx: Здаров! Че тя вчера в аське не было?yyy: Главбухша меня сильно любит!xxx: ?yyy: Рассказываю уже спокойно. Утром, пытаюсь зайти в кабинет, ключ не подходит. Иду к ней. Она с ледяным голосом выдает: ""Сергей, пишите заявление по собственному, или мы вызовем милицию"". Я вспоминаю все свои грехи, спрашиваю какого хрена, собственно. Она визжит, выгоняет меня из кабинета и запирается. Это еще не все!Иду к директору, он говорит: ""Серег, ты это лечись, пока не поздно, это лечиться!"" Я ваще в прострации иду к охраннику, он мне такой: ""Че ты на рабочем месте то ширяешься? Типа другого места не нашел, что ли?"" Тут уже я понимаю, что меня хотят круто подставить, давлю на директора, и узнаю, что утром уборщица из моей мусорки, извлекла пяток шприцов и отнесла их прямиком главбухше. А та соответственно, заварила всю эту кашу. Климакс у ней видите ли!xxx: Термопаста?yyy: Ага, и один с остатками машинного масла.";596
Цитата #30106; 13 мая 2012 ;xxx: Смотрел ночью на кухне эротику по РенТВ. Зашла жена - я быстро переключил, куда попало...xxx: Теперь она считает, что я по ночам закрываюсь на кухне и смотрю Дом-2.;596
Цитата #28893; 30 марта 2012 ;Денис: я тож васпитаныйДенис: Держу ложку в левой нож в правойМаргарита: как это ЛОЖКУ + НОЖ?!Маргарита: уже давно вилку придумали (chuckle)Денис: ну так суп не поеш вилкойМаргарита: а нож зачем к супу?Денис: чтоб суп не отобрали;594
Цитата #31463; 28 июня 2012 ;xxx:Допустим, если бы наступил зомби апокалипсис и некоторые из ваших родных стали зомби, решились бы вы выстрелить в них?yyy:я бы и в живых некоторых с удовольствием;594
Цитата #31877; 14 июля 2012 ;Она: мда, живем с тобой, как две свиньи.Он: как три свиньи.Она: а кто третья?Он: мы вдвоем, как три.;593
Цитата #368; 6 декабря 2007 ;Zxx: блятьZxx: у меня торрент-клиент и антивирь войну затеялиZxx: торрент скачивает кейгенZxx: нортон обнаруживает в нем трояна и пихает в изоляторZxx: торрент проверяет закачку, обнаруживает, что нехватает этого файла и опять его скачиваетZxx: я когда спохватился там уже три кейгена в обезьяннике сидело;592
Цитата #13408; 24 мая 2010 ;"bitoniau:Шел на обед, встретил знакомого воллейболиста. Стали, разговорились. Внезапно мой собеседник технично подпрыгивает и что-то отбивает руками вытянутыми над головой. Проследив траекторию полета ""снаряда"" нахожу офигевшего голубя, который приходит в себя на тротуаре.- Рефлексы! - смущенно оправдывается спорсмен. :)";591
Цитата #19644; 11 марта 2011 ;xxx: Помнишь он всё распинался, люблю, мол, жить без тебя не могу?xxx: Ну я ему проповедь зачитала по поводу того, что себя нужно любить и жить как в последний деньyyy: Это ты умеешь, даxxx: Так этот мудак через неделю бросил курить, пить, пошёл в качалку, занялся собой, стал читать книжки. А через месяц послал меня нахрен такую убогую...;590
Цитата #31985; 19 июля 2012 ;xxx:Мой кот навсегда отучился от привычки охотиться на высунутые из под одеяла части тела, когда по ошибке вместо моей руки накинулся на руку моего мужа. Та и сжалась на автомате вокруг шеи кота и не разжималась в течении минут 30-ти, пока муж окончательно не проснулся. К тому времени кот уже перестал сопротивляться, сидел на кортах и просто ждал.;586
Цитата #11838; 3 марта 2010 ;> Я, я доила! У коровы между задних лап такая штука, за нее доишь! Главное, чтоб копытом в лоб не засветили или хвостом обосранным.при всем уважении, у коровы 4 штукиесли там была одна, то я не удивляюсь ударам копыт!хорошо, что вообще не забодал;584
Цитата #11873; 5 марта 2010 ;sorgu: Захожу в магазин белья за, пардон, трусами. Минут пятнадцать мрачно обозреваю кружевно-стразовый ассортимент и не выдерживаю.Подхожу к девушке-консультанту.- Девушка, подскажите пожалуйста, у вас есть трусы без стразов, без кружев и, желательно, хлопок?- А вам зачем?;584
Цитата #25835; 12 ноября 2011 ;"netmocka: сейчас во дворе пацаны забор разобрали. Крестов наделали. В охоту на вампиров играют ))netmocka: за хлебом пошел и тут выходит на меня мальчик лет 5-и, с крестом. Решил подыграть. Упал, зашипел (в стиле голливудских вампиров). Я слышал, как он кричал - ""Ебтвоюжмать!!!"" убегая XDD";584
Цитата #23433; 1 августа 2011 ;xxx: Меня бесит, когда мухи потирают передние лапки. Как будто у них есть план и мне пиздец.;583
Цитата #30618; 1 июня 2012 ;роженица:Предлагается «выманивать» ребенка на свет и тепло. Для этого на живот необходимо положить холодную грелку, а между ног – теплую. И обеспечить источник яркого света в зоне промежности. Ожидается, что малыш будет стремиться к теплу и свету, и родовой процесс начнется. Также можно включить у влагалища «приглашающую» музыкуроженица:марш мендельсона и фонарик в пизду? я всё правильно поняла?;583
Цитата #12149; 21 марта 2010 ;В кабинете директора проходит совещание. Самого директора нет на месте(его кресло пусто), но он проводит совещание через Skype. В кабинет входит опоздавший сотрудник и, не видя монитора, крадется мимо веб камеры к своему месту.Голос из динамика: Иваныч, сколько можно опаздывать?Иваныч: Кто это?Голос из динамика: Твоя совесть, Иваныч, ГОВОРИТ ТВОЯ СОВЕСТЬ!!;582
Цитата #12625; 14 апреля 2010 ;gr00sh с жж: пару лет назад моя подруга учила итальянский язык, потом забросила это дело – работа, семья. И вот звонит у нее как-то раз под вечер телефон. И на чистом итальянском языке женщина спрашивает какого-то Марио.Девушка не растерялась, отвечает, как учили на курсах:- Вы ошиблись номером. Марио здесь нет.- Вы уверены?- Конечно, уверена. – И добавляет на всякий случай: - Это Москва.- Москва?!! – с характерными истеричными нотками завопила дама. – А ПОЧЕМУ ВЫ ТОГДА ГОВОРИТЕ ПО-ИТАЛЬЯНСКИ?! НУ-КА, СТЕРВА, ЖИВО ПОЗОВИ МНЕ МАРИО!;581
Цитата #17784; 13 декабря 2010 ;C форума владельцев малолитражных автомобилей:rezkiy: Хочу поставить на Матиза пряматочный глушитель. Чтобы звук был мощный и мощи прибавилось. Штатный миня не устраивает. Подскожите, какой лучше ставить и где купить?moderator: кто подскажет - забаню пожизненно!;580
Цитата #19429; 28 февраля 2011 ;Топик на форуме о продаже пианино.Комментарий (орфография сохранена):Кстати, я тоже продаю пианину, то есть отдаю даром. Держу его этажом выше себя - над своей спальней. Адрес скину, если реальный покупатель. там дверь только сломалась - не открывается, но если прийти днем, то ее помогу открыть, вынести помогу тоже, приплачу денег.Также скидки если заберете с собой музыканта.;578
Цитата #19952; 25 марта 2011 ;xxx: Пару недель назад мой муж, собравшись на просмотр квартир, встретился с агентом - молодой девушкой. Сели к ней в машину и поехали по адресам. Было раннее субботнее утро, мужа мучило похмелье, а еще сильнее - чувство стыда за то, что от его дыхания стекла в машине быстро начали запотевать.xxx: Но девушке оказалось не лучше - на запотевшем заднем стекле машины отчетливо проявились отпечатки женских ступней.xxx: Так и ехали, краснея и помалкивая, всю дорогу.;578
Цитата #31302; 22 июня 2012 ;Что вы все заладили: Штаты, Россия, конфликт... Сегодня имел счастье наблюдать реальное столкновение интересов - цыганка, пытающаяся развести свидетелей иеговы.;577
Цитата #32173; 26 июля 2012 ;- товарищ инспектор, перепаркуйте машину с перехода. раз вы ДПС, вам можно что ли?- да, можно.- охуеть, а я пожарный, может мне на заправке покурить?;577
Цитата #29333; 12 апреля 2012 ;"Перед нами садится в автобус молодая пара, обоим лет по двадцать.- Ты никогда обо мне не заботишься, - капризным голосом говорит девушка.- Вот когда на мои слова ""вон идёт наш автобус"" ты будешь отвечать ""да, любимый, пойдём"", а не ""вижу, не слепая!"", тогда я буду о тебе заботиться.";576
Цитата #30194; 16 мая 2012 ;"xxx: Сколько стоит киллера нанять?yyy: а тебе зачем?xxx: Андрюха звонит в 3 ночи и справшивает ""ты спишь"", я говорю да, а он ""а извини, я тогда тебе через час перезвоню"".xxx: И ПЕРЕЗВОНИЛ!";576
Цитата #11097; 24 января 2010 ;F0iL> я сижу и делаю экономикуF0iL> а ты мне сиськи присылаешьF0iL> я не могу работать в такой обстановкеF0iL> давай еще сиськи;575
Цитата #18424; 12 января 2011 ;ууу: ...она у меня такая, палец в рот не клади... умрёшь от оргазма!;575
Цитата #15886; 21 сентября 2010 ;"xxx: я, кстати, крутой для веганов способ пропаганды придумал. Нужно на им пробить закон, чтобы каждую банку тушенки или палку колбасы обязаны были маркировать кличками животных. Скажем, ""мясо, 3 кг, вырезка. Свинья Иллианор"". Или ""Ножки птицы. Индюки Геннадий, Варфоломей, Кузьма""yyy: шпроты геннадий, варфоломей, николай, александр, марина, николай, ефим, анастасия, елена, олег, марфа, михаил, наталья, василий, алексей и володя в масле.zzz: это только в первом ряду.";573
Цитата #17622; 6 декабря 2010 ;"Сидим в офисе транспортной компании, ждем знакомого. Должен быть в 10-00. Время подошло, его нет. Звоним. Сонным голосом говорит, что скоро будет. Ага, из Бирюлево на Проспект Мира в утренний час-пик. Ждем. Звоним через пол-часа.- Ты где?- На Андропова.Проходит еще пол-часа- Ты где?- К трехе подъезжаюПонимаем, что скоро его не ждать. Звоним еще через час.- Ты где?- Все нормально, я тачку бросил у метро, лечу!Ну, думаем, додумался в метро сесть.В результате, приезжает это тело через час после ""я тачку бросил""Спрашиваем его, что так долго? Так этот дебил, бросил тачку возле метро и поймал ПОПУТКУ, ПОПУТКУ ОН, блять поймал!!!";572
Цитата #28356; 7 марта 2012 ;"psy:я поставил будильник на 6 утра, серьезная встреча былав будильнике настроил так, чтобы его отключить или отложить - нужно решить примерточнее, три примера, и поставил тип примера ""сложный""psy:сплю я такой крепко-крепко, и тут звон, трель, вибрацияя вспоминаю, что ставил будильник и смотрю, а там, сука, 234-562+895=думаю спросонья - иди ты нахер с такими вопросамибатарею вытащил и дальше спать";572
Цитата #18009; 22 декабря 2010 ;"20.12.10Примерно 09:30Еду на работу (Ленинский - Садовое - Ленинградка), на дорогах снег сантиметров 5, скорость потока 40 кмч максимум. По радио реклама ледового шоу примерно такого содержания: ""Окунитесь в сказочный мир снега и льда, блаблабла..."". В этот момент стою на светофоре, протираю тряпкой боковое зеркало, которое заляпалось снегом, т.е. окно открыто. И слышу мужика из соседнего такси: ""ДА Я ИТАК, БЛЯДЬ, В СКАЗОЧНОМ МИРЕ СНЕГА И ЛЬДА!"".На одной волне во всех смыслах.";571
Цитата #26751; 26 декабря 2011 ;"Из объяснительной записки:12.12 на складе №4 был разгружен ламинат ""..."" с большим количеством брака. Пачки были отсортированы мной и подписаны, хорошие пачки ""Х"", а плохие пачки ""П"". При возврате товара поставщику, начальник склада ошибочно посчитал, что ""Х"" означает ""хуёвые"", а ""П"" означает ""пиздатые"", что в корне меняло ситуацию. Грузчики его поддержали и на возврат был отгружен качественный товар. Виновным в данном инциденте себя не признаю, услуги транспортной компании оплачивать отказываюсь.";570
Цитата #21872; 31 мая 2011 ;"Я, как и старший брат, в прошлом-заядлый геймер. Только я всегда стратегии любил, а он бродилки.Поехали мы с ним как-то на роликах кататься. Он несётся вперёди и вещает что-то, обернувшись ко мне. Вдруг вижу-едет прямо в яму. Глубокую очень.Мой, тогда ещё детский мозг, не придумал ничего лучше, чем заорать ""пробеееел!!!"".Знаете, он перепрыгнул.";569
Цитата #31618; 4 июля 2012 ;"xxx:У меня мама была воспитателем в детсаду. И поэтому я сгоряча не сужу. К тому же есть дети, которые постоянно попадают во всякие истории. Помню, мама рассказывала: ""Один мальчик зимой лизнул железную качель и прилип. Пока я бегала за теплой водой, прилипли еще пять"".";569
Цитата #25523; 31 октября 2011 ;ххх: у нас с любимой произошел былинный отказууу: что такое?ххх: не виделись месяц почти, то в командировках, то у родителей были. встречу решили отметить, устроив игру в строгого учителя и развратную школьницу. ты же знаешь, она у меня та ещё затейница. подошли к вопросу вдумчиво, Настя купила себе секс-наряд школьницы, я раскопал костюм и галстук, и старательно сочинил контрольную по математике. упор сделал на логарифмы и производные.ууу: и?ххх: сценарий был - типа она не справилась с заданием, ну и выпрашивает пятёрку. а вместо этого мы до 4х утра решали эти чертовы логарифмы... потому что, как выяснилось, позабыли школьную программу напрочь. решили и легли спать...ууу: вы дебилы;568
Цитата #13525; 29 мая 2010 ;xxx: я писал лабу, она почти работалаxxx: то есть в большей части случаев выдавала завышенный результатxxx: лёг спатьxxx: приснился бывший препод по делфи!!!xxx: раскритиковал код, показал, как правильноxxx: проснулся, врубил комп, переписалxxx: РАБОТАЕТ!!!;567
Цитата #32971; 29 августа 2012 ;XXX: О БОЖЕ ПОЧЕМУ МИР ТАК ЖЕСТОК ПОЧЕМУ ПРЕКРАСНЫЕ СОЗДАНИЯ ЭТОГО МИРА МОГУТ ТАК БОЛЬНО ЖАЛИТЬ?!YYY: Что с тобой?XXX: Оладушком обжёгся (((;567
Цитата #16097; 1 октября 2010 ;"111: слышала про ""умный дом""?111: а у меня умная посуда111: сижу щас. слышу с кухни: звяк!111: выхожу. там на полу валяется половник,111: на столе перевёрнутая подставка, где он и всякие ножики-лопатки были111: а на плите пригорает суп, который я поставила разогревать и забыла111: видимо половник спешил на помощь";565
Цитата #20463; 12 апреля 2011 ;Crevice: Жена тут ребенка в парикмахерскую сводила. Обрили почти налысо. Я бы в пять лет за это скандал устроил. А он рукой по голове проводит и спрашивает - Папа, правда я теперь на киви похож?;565
Цитата #33780; 31 октября 2012 ;xxx:У меня мама отожгла по полной. В дороге покупали варёную кукурузу, а к ней дали два белых пакетика с солью. Кукурузу съели, а пакетики вместе с оставшейся едой привезли домой. Мама нашла эти пакетики и решила, что это дозы. В предынфарктном состоянии семья держала совет что делать. В итоге смелый отец проткнул пакетик и на кончике ножа (как в кино учили) лизнул. Только после этого позвонили. Ну, я им сказал, что если решат, что я в кошачьем лотке гашиш прячу, то без меня пусть не пробуют, хочу посмотреть.;564
Цитата #31320; 23 июня 2012 ;"stumon: Помнишь, ты на предложение показать сиськи сказала ""только после свадьбы""?alfeya74: ты опоздал, у меня уже есть мужstumon: Ну так давай, показывай!";561
