Цитата №;Дата;Цитата;Рейтинг
['Цитата #1186', ' 8 сентября 2008 ', ' добавлено:bash.org.ru']; сентября 2008 ;"antidot: Как ориентироваться по зеркалам при перестроении ?Вообще не понимаю, что я там вижу, иногда там разные машинки, а где они расположены, относительно меня, я не понимаю.bearmik : Включай поворотник заранее и перестраивайся плавно. Если что не так - тебе ""подудят"".MJJ: Музыканты на похоронах)))))";863
['Цитата #10804', ' 6 января 2010 ', ' добавлено:bash.org.ru'];6 января 2010 |;было очень весело смотреть 3го января на тытрубе видео, где молодые люди отмечали новый годкто как конечноособенно понравилось видео, где коту приделали мини-парашют и удачно десантировали с 1го этажасмеялсяпока не увидел свою рожу в толпе;863
['Цитата #16763', ' 25 октября 2010 ', ' добавлено:bash.org.ru'];25 октября 2010;"xxx: ""Сегодня в нашем доме в связи с ремонтными работами с 9 до 16 часов будет прекращена подача воды, тепла и электричества.""xxx: И откачан воздух.";863
['Цитата #20509', ' 14 апреля 2011 ', ' добавлено:bash.org.ru'];14 апреля 2011 ;eprst2000: Я вот Алеся, но люди очень часто путают и в спешке называют Оксаной. Уже давно привыкла, спокойно отзываюсь на Оксану и никогда не поправляю. Другие люди называют меня Ксюшей. Логика такая: Оксана – это та же Ксюша. Поэтому на Ксюшу я тоже иду спокойно. Недавно работала с китайцами, для них наши имена хуже смерти. Поэтому они называли меня Сергей.;858
['Цитата #31857', ' 13 июля 2012 ', ' добавлено:bash.org.ru'];13 июля 2012 | ;xxx: Помнишь, я тебе жаловалась, что у меня ухо болит? Так вот, вчера была у лора, он сказал капать спиртом и беречь от воды. А у меня Макс сегодня из командировки приезжает – надо красоту наводить и голову мыть. Пробовала вату в уши засунуть – намокает, пакетики привязать – сваливаются, тут меня осенило презервативы на уши одеть, у нас в ящике коробочка из трех новая валялась, одела - каааайф, вымылась, ничего не попадает и уши сухие. А теперь сижу такая вся нафуфыренная с початой коробочкой и думаю, чё Максу говорить. Что на уши надевала и мылась? Как думаешь, он меня в дурку не сдаст?..;858
['Цитата #13255', ' 16 мая 2010 ', ' добавлено:bash.org.ru'];16 мая 2010 | д;xxx: Чего, как там твой английский? Учишься помаленьку?yyy: hello, my deer friend!xxx: И тебе привет, мой друг-олень!;856
['Цитата #18777', ' 27 января 2011 ', ' добавлено:bash.org.ru'];27 января 2011 ;Fletch: Это что, вот у меня знакомый с прошлой работы действительно неудачно выпендрился. Попросил отвезти его в травму - гипс снять с ноги надо было. Приехали, сижу жду его в коридоре. Выходит этот красавец из дверей кабинета и на радостях, что наконец-то может нормально ходить (2 месяца в гипсе гонял) подпрыгнул, ударил пятка о пятку в воздухе, при приземлении споткнулся на кафеле, упал и сломал руку... Без очереди обратно пустили.;856
['Цитата #18199', ' 30 декабря 2010 ', ' добавлено:bash.org.ru'];30 декабря 2010;М: Привет. Елку купили?Ж: Купили =) Только не знаем, как ее ставить.М: Зеленым вверх.;854
['Цитата #31987', ' 19 июля 2012 ', ' добавлено:bash.org.ru'];19 июля 2012 | ;"xxx:Было это в бытность мою студентом. Охранял я по ночам один ""объект"". Вид у меня был самый что ни на есть студентческий: небритый, взъерошенный, бледный и худой.xxx:Однажды ночью объект решило вскрыть одно чудо, которое для этих целей напялило перчатки, взяло отвертку и пассатижи. В тот момент, когда это чудо снимало штапики с окна, я подкрался к окну изнутри. В темном помещении меня не было видно. Устав наблюдать за чужим ""трудом"" я подсветил свою рожу (небритую, взъерошенную, худую и бледную) фонариком от подбородка вверх и сказал что-то вроде ""бу"".xxx:Чудо округлив глаза заорало на всю округу: Чёрт!!! Чёрт!!! Чёрт!!! После чего ломанулось, не разбирая дороги!xxx:Вот так я разжился неплохой отверткой, пассатижами и комплексом неполноценности.";854
['Цитата #234', ' 30 ноября 2007 ', ' добавлено:admin']; ноября 2007 | ;"xxx: Одна девушка на работе хотела пожаловаться админу на вирь. Печатает она вслепую, немного промахнулась...xxx: Админ сполз под стол, когда в середине дня ему прилетело: ""Втрусы атакуют!""";853
['Цитата #17627', ' 6 декабря 2010 ', ' добавлено:bash.org.ru'];6 декабря 2010 ;"[OZK]ne4eHbKo: Хотели бы вы с криком ""ЭТО СПАРТААААА"" пнуть того, кто мешает вам выйти из автобуса? :D";853
['Цитата #17331', ' 21 ноября 2010 ', ' добавлено:bash.org.ru'];21 ноября 2010 ;Handur: Ну это я потом научился в армии ложкой открывать тушняк и хлеб ложкой резать )Mr White: я один раз без ничего открыл с голодухи. когда курсантом был и на склады поехалиHandur: об камень? А, можно на бок положить и ботинком ударить сверхуMr White: уебал банку об острый угол в кузове, где мы ехали. потом уголок отогнул, зубами его зацепил и потянул на себя, поворачивая банку. потом из той жестянки ложку сделал и стал есть. парни, что со мной ехали, аж отодвинулись подальшеHandur: Рэмбо )Mr White: у рэмбо нож был, а у меня нет. я круче.;851
['Цитата #19448', ' 1 марта 2011 ', ' добавлено:bash.org.ru'];1 марта 2011 | ;amazonka: как мне нравится, когда мой знакомый англичанин комплименты мне делаетamazonka: по-английски всё звучит не так как по-русски, всё красиво, элегантноamazonka: вчера он мне сказал, что обожает меня, потому что я такая русская крейзиthin: так я тебе тоже постоянно говорю, что ты ебанутая;851
['Цитата #16611', ' 18 октября 2010 ', ' добавлено:bash.org.ru'];18 октября 2010;xxx: Вас расстраивает, что ваш ребёнок проводит целый день за компьютером?xxx: Вас беспокоит разрушительное влияние окружения на ребёнка?xxx: Вас волнует будущее вашего ребёнка?xxx: Новопассит! И отъебитесь от ребенка!;850
['Цитата #18394', ' 11 января 2011 ', ' добавлено:bash.org.ru'];11 января 2011 ;"Еду в автобусе, за бортом -30С, внутри не намного теплее. Влезает на одной из остановок школьник, негнущимися пальцами нацарапывает мелочь за проезд. Подходит тётка-кондуктор, в пуховике, валенках. Спрашивает парнягу - ""Далеко едешь?"", тот ""через пару остановок выхожу"" и протягивает мелочь. Кондуктор: ""Езжай бесплатно. Купи себе лучше МОРОЖЕНОГО!""";850
['Цитата #13175', ' 12 мая 2010 ', ' добавлено:bash.org.ru'];12 мая 2010 | д;"ЪFF}: Был вчера в парке Горького, катался на больших горках. Там перед самой ужасной петлей такая пауза, страшно - жуть. Как в ужасах.Lana00: Я знаю как очень дешево можно усилить эффект во много раз. Надо возле того места где пауза поставить мужика в спецовке с гаечным ключом, чтобы он куда-то кричал: ""Йоптыть, остановите их немедленно! Там же всё разломано впереди!"".И поехали потихоньку...";848
['Цитата #332', ' 4 декабря 2007 ', ' добавлено:admin'];декабря 2007 | ;"здаров!Артем, это ты? Это Мишина мама.Здравствуйте, Анна Николаевна!Миша в ванной. Скажи, пожалуйста, а ты не знаешь, что это за папка ""БДСМ""? Я в нее войти не могу.Да это по работе. База Данных Системной Модуляции.А... А то уж я боялась, что это эротика какая-нибудь...";846
['Цитата #17846', ' 15 декабря 2010 ', ' добавлено:bash.org.ru'];15 декабря 2010;иду рожать. схватки. сцуко больно. а оне анамнез собирают:- какая беременность по счету?- первая.- а роды?- вторые, бля!так и записали...;846
['Цитата #288', ' 2 декабря 2007 ', ' добавлено:admin'];декабря 2007 | ;"Сижу в кино, на Беовульфе. Середина фильма.Заламываются 2 полу-пьяных тела, и пытаются понять, куда они попали и их ли это сеанс.Один не выдерживает, и громко спрашивает у зала - ""А че это за фильм??""В этот момент на экране король крупным планом, зовет по имени - ""Беовульф!""Зал лежит. На экране немая сцена.Чуваки офигев оборачиваются, смотрят на короля (он по прежнему крупным планом, молчит, смотрит), говорят ""Спасибо братан!"" и уходят.Интерактивное кино, сцуконах.";845
['Цитата #10111', ' 26 ноября 2009 ', ' добавлено:bash.org.ru'];26 ноября 2009 ;dim_ok: я только что нарколога прошел :-)maniar: Сохранись.;843
['Цитата #1053', ' 1 сентября 2008 ', ' добавлено:bash.org.ru']; сентября 2008 ;Она: Почему когда мы ссоримся - ты молчишь?;842
['Цитата #1071', ' 2 сентября 2008 ', ' добавлено:bash.org.ru']; сентября 2008 ;Я не могу спокойно откручивать крышку бутылки Pepsi, которая со смайликом. Она мне улыбается, а я ей сворачиваю шею;842
['Цитата #17620', ' 6 декабря 2010 ', ' добавлено:bash.org.ru'];6 декабря 2010 ;Галя: Вот почему когда я пуск делаю и по ярлыку две то запускается, а если вот мне к примеру надо не из пуска её то ничего и в красном показывает, а надо ведь чтобы квадратик жёлтенький открывал и там 3 кнопки должно быть?admin: О Боже!admin: Кто-нибудь, пришлите ко мне уборщицу, пусть мой мозг со стен и потолка отмоет;842
['Цитата #16427', ' 12 октября 2010 ', ' добавлено:bash.org.ru'];12 октября 2010;*на тему замены бумажных десяток железными*Ad : Сегодня утром почуствовал себя в средневековье - в трамвае за проезд заплатил два золотых, и получил один серебряный сдачи...;839
['Цитата #33010', ' 30 августа 2012 ', ' добавлено:bash.org.ru'];30 августа 2012;"xxx:Поколение NEXT, это когда рассказываешь, как твоя трехлетняя дочка сама позвонила по скайпу бабушке и даже сама положила трубку, все удивляются ""Ооо, твоя мама скайпом пользоваться умеет!!""";836
['Цитата #10185', ' 30 ноября 2009 ', ' добавлено:bash.org.ru'];30 ноября 2009 ;"xxx: только один раз в жизни мне было действительно стыдно. до сих пор помню, как я, пьяная, с ирокезом на голове, в тельняшке, рваных джинсах и берцах вывалилась на улицу с рок-концерта, чтобы отдышаться после слэма, схватила бутылку пива, отхлебнула. а мимо шла моя ученица-пятиклассница с родителями и громко, звонко со мной поздоровалась. и еще и сказала: ""мама, это та учительница, о которой я тебе рассказывала!""";835
['Цитата #1209', ' 9 сентября 2008 ', ' добавлено:bash.org.ru']; сентября 2008 ;Дело было в Академке МыВэДэ.начальник курса перед строем в 100+ рыл, стоя вместе с руководством Академки гонит на всех:-да вы что, решили меня до смерти довести ??? хер Вам !!! меня убить можно только отсосав !!!громкий шепот из строя:-да мы тебя до самоубийства доведем...ржали так, что вороны с телевышки сыпались в ужасе )));831
['Цитата #30878', ' 10 июня 2012 ', ' добавлено:bash.org.ru'];10 июня 2012 | ;у меня вообще с ч/ю не очень. в батю весь. помню, он дрова на циркулярке пилил. заходит в дом, из кулака кровь, следом красная дорожка.мать: что?..батя: палец отпилил.мать: где палец?батя: там валяется.мать: как?!батя: да я пошутил. вот он!и кулак разжимает. а на ладони - да-да, лежит отпиленный палец.;830
['Цитата #17155', ' 13 ноября 2010 ', ' добавлено:bash.org.ru'];13 ноября 2010 ;"Жена: Как ты там без меня?Муж: Не волнуйся, купил трусы с надписью ""Я женат"".Жена: Кому будешь показывать?!";829
['Цитата #18488', ' 14 января 2011 ', ' добавлено:bash.org.ru'];14 января 2011 ;hett: вам девушкам вообще хорошо: захотел есть, - пошел сварил;829
['Цитата #12269', ' 26 марта 2010 ', ' добавлено:bash.org.ru'];26 марта 2010 |;Утро. Дикий вопль бухгалтера прорезает тишину:- КТО? Кто??! Кто зарегистрировал договор 209-м годом? Система автоматически выставила клиенту счет за весь период! За 1801 год! У меня заявление от клиента, правда ли, что он первый известный оседлый человек на территории Эстонии, предшественник эстонской государственности и наш очень лояльный клиент?!;826
['Цитата #17215', ' 16 ноября 2010 ', ' добавлено:bash.org.ru'];16 ноября 2010 ;xxx: проснулся сегодня от тиканья часов, минуту втыкал откуда у меня тикающие часы, пошел искать в полутьмеxxx: оказалось, кот воду пил;822
['Цитата #12129', ' 19 марта 2010 ', ' добавлено:bash.org.ru'];19 марта 2010 |;"Det: ты уже придумал, как ты будешь делать предложение?Det: Я думаю, нужно придумать что-нибудь оригинальноеDet: Предварительно покажи ей фильм ""Бангкок Хилтон"", чтобы запомнила, что в тайланде за наркотики смертная казнь.Купи путевку в тайланд, собери мешок травы, положи его под кровать в гостинице. С утра пойди к местным ментам, дай им 50 паксов. Они ее повяжут в гостинице, притащат в отделение, будут битый час светить лампой в глаза и что-то лопотать по ихнему.В конце скажут на ломаном английском, что отпустят, если она подпишет бумагу.А на бумаге будет ""ЮЛЯ Я ТЕБЯ ЛЮБЛЮ, ВЫХОДИ ЗА МЕНЯ!"". И появляешься ты с цветами!";821
['Цитата #10724', ' 30 декабря 2009 ', ' добавлено:bash.org.ru'];30 декабря 2009;"xxx: Наша офисная сотрудница уснула, сидя за компом. Спала долго. Тут заходит директор, сотрудница просыпается и начинает изображать бурную деятельность, по клаве долбит, мышку дёргает.xxx: Директор говорит: ""Люда, у нас уже полтора часа света нету"".";817
['Цитата #17119', ' 11 ноября 2010 ', ' добавлено:bash.org.ru'];11 ноября 2010 ;Rol: утром девушка, уходя от меня, забыла кольца, цепочку и мобильныйRol: вот теперь сижу и думаю, либо я был так хорош что она обо всем забылаRol: либо так съебывала на хер от этого кошмара что все побросала?;817
['Цитата #18177', ' 29 декабря 2010 ', ' добавлено:bash.org.ru'];29 декабря 2010;"хххх: Это меня натолкнуло на то, как мой друг в прошлом году елку пилил. Пешком. Выбрал, гат, самую большую - еле тащит. Без одеяла. Ночью. Через перепаханное поле. Там с ним еще человека 3 было. Но у них елки поменьше были и при приближении фар они легли в ямы на поле. А у Сашки, как ни ложись, елка выглядывает. Тогда он её поставил: растет среди поля одинокая елка. Слышит Сашка: машина остановилась, мотор заглушили. И кто-то к нему идет. Чего он там передумал, и насколько сухими остались его штанишки, история умалчивает. Подходит к нему мужик с пилой и лезет прямиком к его елке. И Сашка заорал во всю могучую глотку свою: ""ЗАНЯТО!!"". Мужик мигом испарился.";817
['Цитата #16858', ' 28 октября 2010 ', ' добавлено:bash.org.ru'];28 октября 2010;Решил вот сделать ремонт собственными силами. Ну там поменять гардины, люстры, двери и прочую мелочь. Чтоб не терять времени решил начинать с утра (часов с 8, чтоб на работу успеть). Просыпаюсь, значит по утру, и пока кофе варится, или стену проштраблю, или гардину повешаю, в общем громкая работа. Недели где-то через полторы закончил. Вечером заходит злой сосед:- Ты бы хоть предупредил что закончил, а то мы из-за тебя на работу проспали;815
['Цитата #16151', ' 3 октября 2010 ', ' добавлено:bash.org.ru'];3 октября 2010 ;из ЖЖ:На остановке тётка надрывается, орёт в телефон: - Миша! В холодильнике! В холодильнике суп! Ты слышишь меня?! Миша! В холодильнике! Я тебе не есть его говорила! Вылить! Вылить надо было!;813
['Цитата #16840', ' 27 октября 2010 ', ' добавлено:bash.org.ru'];27 октября 2010;Жалоба на форуме одной мморпг:Не пускает в игру! Я захожу в игру ввожу логин и пароль! Появляется какое то соглашение! Я его усердно читаю и понимаю, что оно не выгодное! Нажимаю не согласиться конечно, но после этого окошко с игрой закрывается! Помогите! Как поиграть в эту игру?;810
['Цитата #15747', ' 15 сентября 2010 ', ' добавлено:bash.org.ru'];15 сентября 201;она: когда пойдем обручальные кольца выбирать?он: а не рановато ли? Может я еще передумаю :)она: ну выплавишь себе зуб золотой.он: какой еще зуб?она: который я тебе выбью!;808
