Цитата №;Дата;Цитата;Рейтинг
['Цитата #16553', ' 15 октября 2010 ', ' добавлено:bash.org.ru'];15 октября 2010;PaRaNoY@На днях ждал свою девушку с института. Пока ждал она попросила сходить в Линию купить туалетную бумагу, рулонов 5.Прихожу в Линию, беру из большой упаковки 4 последние рулона и иду на кассу. на кассе стоит мужик с бабой, 2 битком набитые тележки. Ну решил быстренько проскочить без очереди. Подхожу к мужику прошу пропустить меня. говорю мне быстро. Не пропускает. Стою жду. Тут по привычке решил прохрустеть позвоночник(у меня спина болит, а как хрустну так легчает) И когда хрустел мне нерв зажало и я получается хватаюсь за живот и на лице гримаса боли отчаянья и ужаса. Мужик смотрит на меня, потом на бумагу, багровеет и изрекает: парень, ну ты это... Чего мучаешься та так, иди в перед. Раз такое дело....;984
['Цитата #10869', ' 11 января 2010 ', ' добавлено:bash.org.ru'];11 января 2010 ;Darkast: если будешь следовать, моим советам, то трахнешь её за месяц.Ostrich: Да ты еще не понял. Я же хочу настоящих серьезных отношений. Прям на всю жизнь!Darkast: не вопрос. но трахаться тебе все равно придется.;980
['Цитата #24', ' 25 ноября 2007 ', ' добавлено:admin'];ноября 2007 | д;"имена имеют только бывшие парни... а нынешние - они ""любимый"", ""муж"", етсу мужиков обычно наоборотимена имеют только текущие, а прошлые - ""сука"", ""животное"", ""дура"" етс";978
['Цитата #32197', ' 27 июля 2012 ', ' добавлено:bash.org.ru'];27 июля 2012 | ;xxx: Сегодня директора вызывают к себе в кабинет нашего сисадмина.xxx: Заходит он к ним, через минуту вылетает оттуда с воплями на весь этаж - Ахуели совсем, танки у них тормозят!!!;975
['Цитата #16057', ' 30 сентября 2010 ', ' добавлено:bash.org.ru'];30 сентября 201;xxx: Я даже не представляю, что должен сделать мой сын, что бы я ему сказал, что в молодости я себе такого не позволял.;971
['Цитата #9793', ' 9 ноября 2009 ', ' добавлено:bash.org.ru']; ноября 2009 | ;xxx: Аня, у тебя есть сиськи?yyy: Да! Больше чем у Семенович!xxx: Три?;970
['Цитата #16245', ' 6 октября 2010 ', ' добавлено:bash.org.ru'];6 октября 2010 ;xxx: водитель в Росси должен уметь обруливать ямы, уворачиваться от обруливающих ямы, от лихачей, пешеходов и долбоёбов...;968
['Цитата #19437', ' 28 февраля 2011 ', ' добавлено:bash.org.ru'];28 февраля 2011;"Учредитель поставил мне(гендиру) в соцнагрузку своего племянника в роли коммерческого директора. Парень на первом же собрании объявил себя вождем фирмы, объяснил работникам что он умнее, круче и вообще лучше всех присутствующих. На следующий день мои талантливые дизайнеры сделали ему визитки с должностью ""камерческий директор"", коие он уже месяц раздает на важных встречах.";967
['Цитата #32627', ' 14 августа 2012 ', ' добавлено:bash.org.ru'];14 августа 2012;Ночью потек бочек унитаза, звук был такой, как будто там кот воду лакает. Я с полной уверенностью что так оно и есть, сажусь на кровати, и начинаю кричать коту чтоб прекратил это дело, ибо мешает спать! И тут боковым зрением вижу кота, который сидит рядом и удивленно наблюдает за моими действиями. В эту секунду вся моя логика рухнула, и наступил ужас! :) Залезаю под одеяло, требую что бы муж сходил и посмотрел что там, он смотрит на меняя не менее испугано и говорит: Я не пойду! Я не хочу чтоб на меня напало то, что там лакает!!!;965
['Цитата #12767', ' 21 апреля 2010 ', ' добавлено:bash.org.ru'];21 апреля 2010 ;xxx: В офисе довольно шумно: музыка, разговоры, ксероксы, телефоны, ремонт этажом ниже... решил поискать в инете шумозащитные наушники. Чтоб одел на уши - и тишинааааа... Нашел интересующую модель на сайте оружейного магазина. Сайт интересный, решил полазить. Когда рассматривал понравившуюся модель двустволки - за спиной стало на удивление тихо, даже по телефону шепотом заговорили...xxx: а наушники ли мне нужны?;958
['Цитата #1114', ' 5 сентября 2008 ', ' добавлено:bash.org.ru']; сентября 2008 ;"С форума о сталкереххх: в игре хотелось бы увидеть транспорт хоть какойтотипа велосипеда))ууу: Сталкер в экзоскелете и на ""Аисте"" - это нечто бОльшее, чем просто жесть.";957
['Цитата #14333', ' 12 июля 2010 ', ' добавлено:bash.org.ru'];12 июля 2010 | ;myiworm: У меня кот однажды так же охотился на голубя, крался, крался и на пол–пути уснул.;956
['Цитата #13948', ' 21 июня 2010 ', ' добавлено:bash.org.ru'];21 июня 2010 | ;RazieL_x3: я у тебя пакет с сосиськами забыл (hoop: да, cпасибо;950
['Цитата #19916', ' 24 марта 2011 ', ' добавлено:bash.org.ru'];24 марта 2011 |;Меняли другу на машине тормозные диски. Гараж состоит из множества боксов. Приезжает ауди а8, заезжает в свой бокс. Выходит из машины мужчина, лет 30-35, ставит машину на сигналку, выходя из бокса нажимает кнопочку, автоматические ворота закрываются, гаснет свет в боксе. Мужчина неспеша выходит из гаража. Следующие минут 15-20 мы работаем. Тут хозяин ауди бегом бежит обратно, на бегу открывает ворота, снимает машину с сигнализации, открывает машину, забирает из машины ДОЧЬ, закрывает машину, ворота бокса, выходит из гаража, держа дочь за руку.А девочка спокойная, видимо уже не в первой.;946
['Цитата #17701', ' 9 декабря 2010 ', ' добавлено:bash.org.ru'];9 декабря 2010 ;Maxim1905: День добрый! У меня вопрос можно Легенду подключить в ноутбуку через блютус и писать инет через нее через GPRS? Кто нибудь пробовать, есть такая возможность?ska_romash: Пока читать сообщение твоё, моя обрезать орган мозг и топтать и топтать его, пока читать ваша сообщение ещё раз.ska_romash: Простите, не выдержал.;943
['Цитата #29735', ' 25 апреля 2012 ', ' добавлено:bash.org.ru'];25 апреля 2012 ;"Сижу, ем.Идут к столику парень лет 18 и классно одетая женщина явно старше 30, оба с подносамиПодлетает ссыкуха, орет ""Сукин ублюдок, я тебя в рот в нос и тд, я тебе не нравлюсь - меняешь меня на старух, сука"" переворачивает поднос в руках у женщины и убегает.Я сижу спокойно, через 5 минут они приносят еще 1 поднос и молча едятИ фраза: ""Мам, ну наверно это лучший комплимент!""";942
['Цитата #18098', ' 27 декабря 2010 ', ' добавлено:bash.org.ru'];27 декабря 2010;Метро. Давка. Рядом женщина с ребенком:Женщина: Андрюшенька, ты еще живой?Ребенок(угрюмо): Ага. Последняя жизнь осталась.;940
['Цитата #16691', ' 21 октября 2010 ', ' добавлено:bash.org.ru'];21 октября 2010;MRR: Мне очень перепись понравилась! Вчера, уже вечером, пришли две девушки, а ушли сегодня в 12 дня! Сказали, что завтра опять придут.;931
['Цитата #17150', ' 13 ноября 2010 ', ' добавлено:bash.org.ru'];13 ноября 2010 ;(bormor): Над компьютером висит рок. Поменял диск - сгорел процессор. Поменял процессор и материнскую плату - сдох экран. Привёл в чувство экран - отказала клавиатура. Нашёл и поставил другую клавиатуру - мышка упала и разбилась.Поменял ВСЁ!!!Развалился стул на колёсиках.;923
['Цитата #11853', ' 4 марта 2010 ', ' добавлено:bash.org.ru'];4 марта 2010 | ;"rinel: Один товарищ рассказывал: шел он с работы, нес в сумке баллончик с золотой краской - оформлял стенд на работе. И вот подходит к нему цыганка и нагло требует: ""А позолоти ручку!"" Думаю, что было дальше, и так ясно :)";919
['Цитата #348', ' 5 декабря 2007 ', ' добавлено:admin'];декабря 2007 | ;"xxx:Все-таки поэт Чуковский - настоящий гений. Придумать такие удобные строчки ""Убежало одеяло, улетела простыня"" и не срифмовать впоследствии со словами ""заебало"" и ""хуйня"" - это вообще то только одному богу известно, сколько нужно тренироваться";917
['Цитата #28732', ' 23 марта 2012 ', ' добавлено:bash.org.ru'];23 марта 2012 |;xxx: я бы вылизал твои сисечкиyyy: ты бы лучше комнату свою вылизал. Толку больше было бы.xxx: блин, пап, это не тебе (((;917
['Цитата #11773', ' 28 февраля 2010 ', ' добавлено:bash.org.ru'];28 февраля 2010;ххх: Какой твой любимый герой компьютерных игр?ууу: палка из тетриса;916
['Цитата #16285', ' 7 октября 2010 ', ' добавлено:bash.org.ru'];7 октября 2010 ;C форума:xxx: хочу купить LSD для просмотра SD и HD спутниковых каналов и цифрового эфирного ТВ.yyy: После LSD можно будет даже ковер на стене смотреть - там будет и 3D, и все прочие новинки киновидеопроката...;916
['Цитата #16127', ' 2 октября 2010 ', ' добавлено:bash.org.ru'];2 октября 2010 ;Пума: Пообещали нас штрафовать за опоздания, я опоздала на 20 мин, но не обнаружила никого, кто мог бы меня оштрафовать );913
['Цитата #17779', ' 13 декабря 2010 ', ' добавлено:bash.org.ru'];13 декабря 2010;Лекция по философии. Препод(П)говорит о разнице между материей и сознанием.П: Сознание не обладает протяженностью. Нам не может прийти мысль на 15 см. И мы не можем подумать на 2 кг!Студент: А сообразить на поллитра - запросто...;911
['Цитата #10993', ' 17 января 2010 ', ' добавлено:bash.org.ru'];17 января 2010 ;Выбираем с мамой платье (я собралась к подружке на свадьбу):мама: а давай тебе ещё комплект белья красивый купим?я: да ладно, я ж не невеста...мама: ну мало ли что на свадьбе произойти может! Что бы потом в морге стыдно не было...;910
['Цитата #15313', ' 25 августа 2010 ', ' добавлено:bash.org.by'];25 августа 2010;xxx: Как дела?yyy: Нормально. Кот спит без задних ног, я - жарю окорочка.xxx: живодер!!!;907
['Цитата #18276', ' 4 января 2011 ', ' добавлено:bash.org.ru'];4 января 2011 |;xxx: А мой бывший мч на просьбу отдать своего кота маме (у меня аллергия), ответил, что кот с ним 10 лет, а я только полтора месяца, и мы расстались. Это вообще нормально?;907
['Цитата #30511', ' 29 мая 2012 ', ' добавлено:bash.org.ru'];29 мая 2012 | д;"xxx:То есть Вы считаете, Алексей, что единственное, что может не устроить меня в Вашей дипломной работе, которую я только что получила на e-mail - это ""ошибочное"" название ""Свежескаченное Говнецо""?";906
['Цитата #11762', ' 27 февраля 2010 ', ' добавлено:bash.org.ru'];27 февраля 2010;"prefix: Сегодня едем втроем с друзьями в такси, я на переднем сиденьиprefix: Подъезжаем к парадной, спрашиваю таксиста: ""Сколько?""prefix: Таксист говорит 200prefix: Я повернувшись к таксисту говорю ""нас четверо значит с каждого по 50""prefix: Все дают по 50, таксист тоже вытаскивает полтинник и отдаёт мне.prefix: Я все деньги отдаю таксисту, тот пересчитывает, говорит ""до свиданья""prefix: Только поднявшись по лестнице мы поняли, что что-то не так...";904
['Цитата #16612', ' 18 октября 2010 ', ' добавлено:bash.org.ru'];18 октября 2010;ххх: уже четвертая свадьба одного их бывших, который после меня нашёл ту, что нужна. ну пиздец. после меня любая - та, что нужна.;903
['Цитата #30282', ' 20 мая 2012 ', ' добавлено:bash.org.ru'];20 мая 2012 | д;SKYPIDAR: чо вы докопались к моему нику, это СКИПИДАР, причем тут небесный вообще???;901
['Цитата #20124', ' 1 апреля 2011 ', ' добавлено:bash.org.ru'];1 апреля 2011 |;DoubleDJ: Еду на машине около 90км/ч, навстречу едет машина ДПС и дальнем светом мне моргает.DoubleDJ: Задумался, но на всякий случай притормозил до 60.DoubleDJ: И точно! Впереди на обочине ещё один наряд ДПС ловит радаром.DoubleDJ: Враждующие кланы? :);900
['Цитата #14894', ' 5 августа 2010 ', ' добавлено:bash.org.ru'];5 августа 2010 ;"ppp: меня когда-то девушка притянула в воскресную школуppp: когда я заходил в ворота, увидел нищих и голодных бабушек. в эти же ворота въехал настоятель церкви на новом меринеppp: тема лекции была ""мы должны делится и помогать ближним""ppp: после вопроса-предложения ""давайте продадим мерин батюшки и накормим бабулек"" меня выгнали из школы...";896
['Цитата #11654', ' 21 февраля 2010 ', ' добавлено:bash.org.ru'];21 февраля 2010;[Torin IV]: Лёха, мне тут сказали, что у вас нету октябрьского вокзала?[Sovintel]: нету )[Torin IV]: а то у меня проблемка тут... я на него приезжаю;887
['Цитата #10737', ' 31 декабря 2009 ', ' добавлено:bash.org.ru'];31 декабря 2009;beauty_by_wild: ооо, это прекрасноbeauty_by_wild: у нас в отделе две секретарши - лена и света. света сегодня по дороге на работу купила где-то там новые брюки. пришла, переоделась такая радостная, юбку оставила на стуле у себя, и к шефу пошла отчитываццо. приходит начальник отдела, спрашивает тут ли света. лена и говорит: здесь она, здесь, александр михалыч, она у шефа. (показывая на стул) вот и юбка ее висит!beauty_by_wild: о, какие у него были глаза...;885
['Цитата #13382', ' 22 мая 2010 ', ' добавлено:bash.org.ru'];22 мая 2010 | д;"С женского форума. Тема называется: ""А с вами работает закон подлости ""Не накрасилась, или просто вид не очень, и кого-нибудь встретила""?""ХХХ: Я как-то раз встретила бывшего, бывший из серии ""вот пройдет много лет, он меня увидит и пожалеет, что такая красавица и не с ним"". Ага, счаз. Встретила я его по дороге в аптеку, вокруг глаза у меня огромный фингал, соответственно - морда лица опухшая, голова немытая (не до нее с такой икебаной на лице), в прозрачном пакете - бутылка с водкой (куплена с целью сделать компресс). Наверно, я ему до сих пор снюсь в страшных снах. Обидно было до соплей.";884
['Цитата #17303', ' 19 ноября 2010 ', ' добавлено:bash.org.ru'];19 ноября 2010 ;Денис: Ты в чем?Надюха: в красных трусикахДенис: А подробней?Надюха: 50% синтетики 50% хлопка;884
['Цитата #17449', ' 27 ноября 2010 ', ' добавлено:bash.org.ru'];27 ноября 2010 ;знаешь что самое обидное когда варенники варишь?что они развариваются?нета что?когда вода вскипела открываешь холодильник, а варенников нет;881
['Цитата #12623', ' 14 апреля 2010 ', ' добавлено:bash.org.ru'];14 апреля 2010 ;с женского форумаxxx:Ребенок стоял в кроватке и пускал слюни. Ну, понятное дело - зубы.Муж решил вытереть, но КАК!Взял ребенка за голову и лицом о простыню вытер!;876
['Цитата #14419', ' 14 июля 2010 ', ' добавлено:bash.org.ru'];14 июля 2010 | ;dedmorozzz: проспал сегодня на работуdedmorozzz: звоню, говорю что воды нетdedmorozzz: иду в ванную - и действительно, воды нетdedmorozzz: в следующий раз скажу, что деньгами дверь изнутри завалило;876
['Цитата #16042', ' 29 сентября 2010 ', ' добавлено:bash.org.ru'];29 сентября 201;xxx: тяжело оказывается делать вид, что работаешьxxx: работать легче;871
['Цитата #9913', ' 15 ноября 2009 ', ' добавлено:bash.org.ru'];5 ноября 2009 |;xxx: чем ты занимался сегодня, любимый?yyy: ездил справку для универа делать, потом к родителям заехал, отдал папе тот диск, про который тебе говорил, потом на работу.xxx: а я думала, ты по мне скучал :(yyy: прости, я все время забываю правильный ответ;869
['Цитата #7039', ' 3 октября 2009 ', ' добавлено:bash.org.ru']; октября 2009 |;Lucky Man ®: нравятся члены?Leela: конечно, я же девушкаLucky Man ®: а какие тебе нравятся?Leela: такие, у которых на одном из концов находится умный мужик :)Lucky Man ®: это как?Leela: забей;868
['Цитата #11731', ' 26 февраля 2010 ', ' добавлено:bash.org.ru'];26 февраля 2010;"ххх: Вот не отнять у некоторых людей интеллигентность. Попросила вчера мужа во время секса назвать шлюхой. В итоге в кульминационный момент в свой адрес услышала: ""Девка гарнизонная""";866
['Цитата #16208', ' 5 октября 2010 ', ' добавлено:bash.org.ru'];5 октября 2010 ;"NewParadigm: случай недавно был. Еду в общагу, в автобусе все сиденья заняты, салон почти пустой - стоит только тело крайне гоповатого вида. Держится за поручень, пальцем (от нечего делать, видимо) качает свисающую на ремне ручку (на поручне которые, чтобы людям пониже держаться было удобнее). На повороте не рассчитывает и легонько стукает себя этой самой ручкой по затылку. После этого дерает бычье лицо и с воплем ""Ты че, охуел бля?!"" оборачивается - а там никого...";865
['Цитата #19856', ' 22 марта 2011 ', ' добавлено:bash.org.ru'];22 марта 2011 |;"Конунг: Выбрасывал с братом старый унитаз. Подошли к помойке - она завалена мусором в радиусе десяти метров.Конунг: Решили раскачать и бросить. Качаем...Конунг: Вовик такой - ""Прости, Винченцо, ты слишком много знаешь!""Конунг: Унитаз улетел в другую сторону, потому что от смеха у меня отказали конечности.";865
