Цитата №;Дата;Цитата;Рейтинг
Цитата #28732; 23 марта 2012 ;xxx: я бы вылизал твои сисечкиyyy: ты бы лучше комнату свою вылизал. Толку больше было бы.xxx: блин, пап, это не тебе (((;917
Цитата #11773; 28 февраля 2010 ;ххх: Какой твой любимый герой компьютерных игр?ууу: палка из тетриса;916
Цитата #16285; 7 октября 2010 ;C форума:xxx: хочу купить LSD для просмотра SD и HD спутниковых каналов и цифрового эфирного ТВ.yyy: После LSD можно будет даже ковер на стене смотреть - там будет и 3D, и все прочие новинки киновидеопроката...;916
Цитата #16127; 2 октября 2010 ;Пума: Пообещали нас штрафовать за опоздания, я опоздала на 20 мин, но не обнаружила никого, кто мог бы меня оштрафовать );914
Цитата #17779; 13 декабря 2010 ;Лекция по философии. Препод(П)говорит о разнице между материей и сознанием.П: Сознание не обладает протяженностью. Нам не может прийти мысль на 15 см. И мы не можем подумать на 2 кг!Студент: А сообразить на поллитра - запросто...;911
Цитата #10993; 17 января 2010 ;Выбираем с мамой платье (я собралась к подружке на свадьбу):мама: а давай тебе ещё комплект белья красивый купим?я: да ладно, я ж не невеста...мама: ну мало ли что на свадьбе произойти может! Что бы потом в морге стыдно не было...;910
Цитата #15313; 25 августа 2010 ;xxx: Как дела?yyy: Нормально. Кот спит без задних ног, я - жарю окорочка.xxx: живодер!!!;907
Цитата #18276; 4 января 2011 ;xxx: А мой бывший мч на просьбу отдать своего кота маме (у меня аллергия), ответил, что кот с ним 10 лет, а я только полтора месяца, и мы расстались. Это вообще нормально?;907
Цитата #30511; 29 мая 2012 ;"xxx:То есть Вы считаете, Алексей, что единственное, что может не устроить меня в Вашей дипломной работе, которую я только что получила на e-mail - это ""ошибочное"" название ""Свежескаченное Говнецо""?";907
Цитата #11762; 27 февраля 2010 ;"prefix: Сегодня едем втроем с друзьями в такси, я на переднем сиденьиprefix: Подъезжаем к парадной, спрашиваю таксиста: ""Сколько?""prefix: Таксист говорит 200prefix: Я повернувшись к таксисту говорю ""нас четверо значит с каждого по 50""prefix: Все дают по 50, таксист тоже вытаскивает полтинник и отдаёт мне.prefix: Я все деньги отдаю таксисту, тот пересчитывает, говорит ""до свиданья""prefix: Только поднявшись по лестнице мы поняли, что что-то не так...";904
Цитата #16612; 18 октября 2010 ;ххх: уже четвертая свадьба одного их бывших, который после меня нашёл ту, что нужна. ну пиздец. после меня любая - та, что нужна.;904
Цитата #30282; 20 мая 2012 ;SKYPIDAR: чо вы докопались к моему нику, это СКИПИДАР, причем тут небесный вообще???;901
Цитата #20124; 1 апреля 2011 ;DoubleDJ: Еду на машине около 90км/ч, навстречу едет машина ДПС и дальнем светом мне моргает.DoubleDJ: Задумался, но на всякий случай притормозил до 60.DoubleDJ: И точно! Впереди на обочине ещё один наряд ДПС ловит радаром.DoubleDJ: Враждующие кланы? :);900
Цитата #14894; 5 августа 2010 ;"ppp: меня когда-то девушка притянула в воскресную школуppp: когда я заходил в ворота, увидел нищих и голодных бабушек. в эти же ворота въехал настоятель церкви на новом меринеppp: тема лекции была ""мы должны делится и помогать ближним""ppp: после вопроса-предложения ""давайте продадим мерин батюшки и накормим бабулек"" меня выгнали из школы...";896
Цитата #11654; 21 февраля 2010 ;[Torin IV]: Лёха, мне тут сказали, что у вас нету октябрьского вокзала?[Sovintel]: нету )[Torin IV]: а то у меня проблемка тут... я на него приезжаю;889
Цитата #10737; 31 декабря 2009 ;beauty_by_wild: ооо, это прекрасноbeauty_by_wild: у нас в отделе две секретарши - лена и света. света сегодня по дороге на работу купила где-то там новые брюки. пришла, переоделась такая радостная, юбку оставила на стуле у себя, и к шефу пошла отчитываццо. приходит начальник отдела, спрашивает тут ли света. лена и говорит: здесь она, здесь, александр михалыч, она у шефа. (показывая на стул) вот и юбка ее висит!beauty_by_wild: о, какие у него были глаза...;886
Цитата #13382; 22 мая 2010 ;"С женского форума. Тема называется: ""А с вами работает закон подлости ""Не накрасилась, или просто вид не очень, и кого-нибудь встретила""?""ХХХ: Я как-то раз встретила бывшего, бывший из серии ""вот пройдет много лет, он меня увидит и пожалеет, что такая красавица и не с ним"". Ага, счаз. Встретила я его по дороге в аптеку, вокруг глаза у меня огромный фингал, соответственно - морда лица опухшая, голова немытая (не до нее с такой икебаной на лице), в прозрачном пакете - бутылка с водкой (куплена с целью сделать компресс). Наверно, я ему до сих пор снюсь в страшных снах. Обидно было до соплей.";885
Цитата #17303; 19 ноября 2010 ;Денис: Ты в чем?Надюха: в красных трусикахДенис: А подробней?Надюха: 50% синтетики 50% хлопка;884
Цитата #17449; 27 ноября 2010 ;знаешь что самое обидное когда варенники варишь?что они развариваются?нета что?когда вода вскипела открываешь холодильник, а варенников нет;882
Цитата #12623; 14 апреля 2010 ;с женского форумаxxx:Ребенок стоял в кроватке и пускал слюни. Ну, понятное дело - зубы.Муж решил вытереть, но КАК!Взял ребенка за голову и лицом о простыню вытер!;876
Цитата #14419; 14 июля 2010 ;dedmorozzz: проспал сегодня на работуdedmorozzz: звоню, говорю что воды нетdedmorozzz: иду в ванную - и действительно, воды нетdedmorozzz: в следующий раз скажу, что деньгами дверь изнутри завалило;876
Цитата #16042; 29 сентября 2010 ;xxx: тяжело оказывается делать вид, что работаешьxxx: работать легче;871
Цитата #9913; 15 ноября 2009 ;xxx: чем ты занимался сегодня, любимый?yyy: ездил справку для универа делать, потом к родителям заехал, отдал папе тот диск, про который тебе говорил, потом на работу.xxx: а я думала, ты по мне скучал :(yyy: прости, я все время забываю правильный ответ;870
Цитата #7039; 3 октября 2009 ;Lucky Man ®: нравятся члены?Leela: конечно, я же девушкаLucky Man ®: а какие тебе нравятся?Leela: такие, у которых на одном из концов находится умный мужик :)Lucky Man ®: это как?Leela: забей;869
Цитата #11731; 26 февраля 2010 ;"ххх: Вот не отнять у некоторых людей интеллигентность. Попросила вчера мужа во время секса назвать шлюхой. В итоге в кульминационный момент в свой адрес услышала: ""Девка гарнизонная""";866
Цитата #16208; 5 октября 2010 ;"NewParadigm: случай недавно был. Еду в общагу, в автобусе все сиденья заняты, салон почти пустой - стоит только тело крайне гоповатого вида. Держится за поручень, пальцем (от нечего делать, видимо) качает свисающую на ремне ручку (на поручне которые, чтобы людям пониже держаться было удобнее). На повороте не рассчитывает и легонько стукает себя этой самой ручкой по затылку. После этого дерает бычье лицо и с воплем ""Ты че, охуел бля?!"" оборачивается - а там никого...";865
Цитата #19856; 22 марта 2011 ;"Конунг: Выбрасывал с братом старый унитаз. Подошли к помойке - она завалена мусором в радиусе десяти метров.Конунг: Решили раскачать и бросить. Качаем...Конунг: Вовик такой - ""Прости, Винченцо, ты слишком много знаешь!""Конунг: Унитаз улетел в другую сторону, потому что от смеха у меня отказали конечности.";865
Цитата #16763; 25 октября 2010 ;"xxx: ""Сегодня в нашем доме в связи с ремонтными работами с 9 до 16 часов будет прекращена подача воды, тепла и электричества.""xxx: И откачан воздух.";864
Цитата #1186; 8 сентября 2008 ;"antidot: Как ориентироваться по зеркалам при перестроении ?Вообще не понимаю, что я там вижу, иногда там разные машинки, а где они расположены, относительно меня, я не понимаю.bearmik : Включай поворотник заранее и перестраивайся плавно. Если что не так - тебе ""подудят"".MJJ: Музыканты на похоронах)))))";863
Цитата #10804; 6 января 2010 ;было очень весело смотреть 3го января на тытрубе видео, где молодые люди отмечали новый годкто как конечноособенно понравилось видео, где коту приделали мини-парашют и удачно десантировали с 1го этажасмеялсяпока не увидел свою рожу в толпе;863
Цитата #20509; 14 апреля 2011 ;eprst2000: Я вот Алеся, но люди очень часто путают и в спешке называют Оксаной. Уже давно привыкла, спокойно отзываюсь на Оксану и никогда не поправляю. Другие люди называют меня Ксюшей. Логика такая: Оксана – это та же Ксюша. Поэтому на Ксюшу я тоже иду спокойно. Недавно работала с китайцами, для них наши имена хуже смерти. Поэтому они называли меня Сергей.;859
Цитата #31857; 13 июля 2012 ;xxx: Помнишь, я тебе жаловалась, что у меня ухо болит? Так вот, вчера была у лора, он сказал капать спиртом и беречь от воды. А у меня Макс сегодня из командировки приезжает – надо красоту наводить и голову мыть. Пробовала вату в уши засунуть – намокает, пакетики привязать – сваливаются, тут меня осенило презервативы на уши одеть, у нас в ящике коробочка из трех новая валялась, одела - каааайф, вымылась, ничего не попадает и уши сухие. А теперь сижу такая вся нафуфыренная с початой коробочкой и думаю, чё Максу говорить. Что на уши надевала и мылась? Как думаешь, он меня в дурку не сдаст?..;858
Цитата #13255; 16 мая 2010 ;xxx: Чего, как там твой английский? Учишься помаленьку?yyy: hello, my deer friend!xxx: И тебе привет, мой друг-олень!;856
Цитата #18777; 27 января 2011 ;Fletch: Это что, вот у меня знакомый с прошлой работы действительно неудачно выпендрился. Попросил отвезти его в травму - гипс снять с ноги надо было. Приехали, сижу жду его в коридоре. Выходит этот красавец из дверей кабинета и на радостях, что наконец-то может нормально ходить (2 месяца в гипсе гонял) подпрыгнул, ударил пятка о пятку в воздухе, при приземлении споткнулся на кафеле, упал и сломал руку... Без очереди обратно пустили.;856
Цитата #31987; 19 июля 2012 ;"xxx:Было это в бытность мою студентом. Охранял я по ночам один ""объект"". Вид у меня был самый что ни на есть студентческий: небритый, взъерошенный, бледный и худой.xxx:Однажды ночью объект решило вскрыть одно чудо, которое для этих целей напялило перчатки, взяло отвертку и пассатижи. В тот момент, когда это чудо снимало штапики с окна, я подкрался к окну изнутри. В темном помещении меня не было видно. Устав наблюдать за чужим ""трудом"" я подсветил свою рожу (небритую, взъерошенную, худую и бледную) фонариком от подбородка вверх и сказал что-то вроде ""бу"".xxx:Чудо округлив глаза заорало на всю округу: Чёрт!!! Чёрт!!! Чёрт!!! После чего ломанулось, не разбирая дороги!xxx:Вот так я разжился неплохой отверткой, пассатижами и комплексом неполноценности.";856
Цитата #18199; 30 декабря 2010 ;М: Привет. Елку купили?Ж: Купили =) Только не знаем, как ее ставить.М: Зеленым вверх.;855
Цитата #234; 30 ноября 2007 ;"xxx: Одна девушка на работе хотела пожаловаться админу на вирь. Печатает она вслепую, немного промахнулась...xxx: Админ сполз под стол, когда в середине дня ему прилетело: ""Втрусы атакуют!""";853
Цитата #17627; 6 декабря 2010 ;"[OZK]ne4eHbKo: Хотели бы вы с криком ""ЭТО СПАРТААААА"" пнуть того, кто мешает вам выйти из автобуса? :D";853
Цитата #17331; 21 ноября 2010 ;Handur: Ну это я потом научился в армии ложкой открывать тушняк и хлеб ложкой резать )Mr White: я один раз без ничего открыл с голодухи. когда курсантом был и на склады поехалиHandur: об камень? А, можно на бок положить и ботинком ударить сверхуMr White: уебал банку об острый угол в кузове, где мы ехали. потом уголок отогнул, зубами его зацепил и потянул на себя, поворачивая банку. потом из той жестянки ложку сделал и стал есть. парни, что со мной ехали, аж отодвинулись подальшеHandur: Рэмбо )Mr White: у рэмбо нож был, а у меня нет. я круче.;851
Цитата #19448; 1 марта 2011 ;amazonka: как мне нравится, когда мой знакомый англичанин комплименты мне делаетamazonka: по-английски всё звучит не так как по-русски, всё красиво, элегантноamazonka: вчера он мне сказал, что обожает меня, потому что я такая русская крейзиthin: так я тебе тоже постоянно говорю, что ты ебанутая;851
Цитата #16611; 18 октября 2010 ;xxx: Вас расстраивает, что ваш ребёнок проводит целый день за компьютером?xxx: Вас беспокоит разрушительное влияние окружения на ребёнка?xxx: Вас волнует будущее вашего ребёнка?xxx: Новопассит! И отъебитесь от ребенка!;850
Цитата #18394; 11 января 2011 ;"Еду в автобусе, за бортом -30С, внутри не намного теплее. Влезает на одной из остановок школьник, негнущимися пальцами нацарапывает мелочь за проезд. Подходит тётка-кондуктор, в пуховике, валенках. Спрашивает парнягу - ""Далеко едешь?"", тот ""через пару остановок выхожу"" и протягивает мелочь. Кондуктор: ""Езжай бесплатно. Купи себе лучше МОРОЖЕНОГО!""";850
Цитата #13175; 12 мая 2010 ;"ЪFF}: Был вчера в парке Горького, катался на больших горках. Там перед самой ужасной петлей такая пауза, страшно - жуть. Как в ужасах.Lana00: Я знаю как очень дешево можно усилить эффект во много раз. Надо возле того места где пауза поставить мужика в спецовке с гаечным ключом, чтобы он куда-то кричал: ""Йоптыть, остановите их немедленно! Там же всё разломано впереди!"".И поехали потихоньку...";848
Цитата #17846; 15 декабря 2010 ;иду рожать. схватки. сцуко больно. а оне анамнез собирают:- какая беременность по счету?- первая.- а роды?- вторые, бля!так и записали...;847
Цитата #288; 2 декабря 2007 ;"Сижу в кино, на Беовульфе. Середина фильма.Заламываются 2 полу-пьяных тела, и пытаются понять, куда они попали и их ли это сеанс.Один не выдерживает, и громко спрашивает у зала - ""А че это за фильм??""В этот момент на экране король крупным планом, зовет по имени - ""Беовульф!""Зал лежит. На экране немая сцена.Чуваки офигев оборачиваются, смотрят на короля (он по прежнему крупным планом, молчит, смотрит), говорят ""Спасибо братан!"" и уходят.Интерактивное кино, сцуконах.";846
Цитата #332; 4 декабря 2007 ;"здаров!Артем, это ты? Это Мишина мама.Здравствуйте, Анна Николаевна!Миша в ванной. Скажи, пожалуйста, а ты не знаешь, что это за папка ""БДСМ""? Я в нее войти не могу.Да это по работе. База Данных Системной Модуляции.А... А то уж я боялась, что это эротика какая-нибудь...";846
Цитата #10111; 26 ноября 2009 ;dim_ok: я только что нарколога прошел :-)maniar: Сохранись.;843
Цитата #1053; 1 сентября 2008 ;Она: Почему когда мы ссоримся - ты молчишь?;842
Цитата #1071; 2 сентября 2008 ;Я не могу спокойно откручивать крышку бутылки Pepsi, которая со смайликом. Она мне улыбается, а я ей сворачиваю шею;842
Цитата #17620; 6 декабря 2010 ;Галя: Вот почему когда я пуск делаю и по ярлыку две то запускается, а если вот мне к примеру надо не из пуска её то ничего и в красном показывает, а надо ведь чтобы квадратик жёлтенький открывал и там 3 кнопки должно быть?admin: О Боже!admin: Кто-нибудь, пришлите ко мне уборщицу, пусть мой мозг со стен и потолка отмоет;842
Цитата #16427; 12 октября 2010 ;*на тему замены бумажных десяток железными*Ad : Сегодня утром почуствовал себя в средневековье - в трамвае за проезд заплатил два золотых, и получил один серебряный сдачи...;839
Цитата #33010; 30 августа 2012 ;"xxx:Поколение NEXT, это когда рассказываешь, как твоя трехлетняя дочка сама позвонила по скайпу бабушке и даже сама положила трубку, все удивляются ""Ооо, твоя мама скайпом пользоваться умеет!!""";837
Цитата #10185; 30 ноября 2009 ;"xxx: только один раз в жизни мне было действительно стыдно. до сих пор помню, как я, пьяная, с ирокезом на голове, в тельняшке, рваных джинсах и берцах вывалилась на улицу с рок-концерта, чтобы отдышаться после слэма, схватила бутылку пива, отхлебнула. а мимо шла моя ученица-пятиклассница с родителями и громко, звонко со мной поздоровалась. и еще и сказала: ""мама, это та учительница, о которой я тебе рассказывала!""";835
